,dt,title
142,2023-12-07 06:30:00,"Taylor Swift named Time  Person of the Year , capping her record - breaking 2023"
215,2023-12-07 07:45:00,1 Electric Vehicle Stock to Buy Hand Over Fist in December
216,2023-12-07 10:45:00,"After Fisker 81 % November Plunge , Is it Time to Panic ? "
181,2023-12-07 13:30:00,The 7 Best S & P 500 Stocks to Buy in December
100,2023-12-07 14:30:00,"EV watch : Rivian Automotive lands Buy rating at Stifel , Lucid set at Hold"
105,2023-12-07 15:30:00,Swedish court rules against Tesla in dispute with postal service over deliveries
212,2023-12-07 15:30:00,XPeng Deliveries Surge Almost 2 . 5x . What Next For The Stock ? 
6,2023-12-07 18:15:00,Indian automakers do not want Tesla to catch a break on import taxes
126,2023-12-07 18:15:00,Tesla executive overseeing Dojo supercomputer departs : report
169,2023-12-07 18:45:00,"Stock market news today : Stocks pop , tech leads as focus fixes on jobs data"
149,2023-12-07 20:15:00,Tesla Dojo Shakeup ! Ganesh Venkataramanan Reportedly Exits The EV Giant Supercomputer Project On Autonomous - Driving Software - Tesla ( NASDAQ : TSLA ) 
48,2023-12-07 20:15:00,Swedish court rules against Tesla in labour dispute ; Finnish union joins strike
107,2023-12-07 22:00:00,"Tesla Inc . stock rises Thursday , still underperforms market"
154,2023-12-07 23:45:00,Tesla can sell you a Cybertruck very soon -- if you have deep pockets
171,2023-12-08 01:30:00,"Stock Market Today : Tech Stocks Soar as AMD , Alphabet Rally"
146,2023-12-08 03:00:00,Tesla can sell you a Cybertruck very soon -- if you have deep pockets
46,2023-12-08 12:00:00,Tesla labour dispute ignites Nordic sympathy strikes
54,2023-12-08 13:15:00,Rivian reportedly lays off members of battery development team
182,2023-12-08 14:00:00,"Tesla must respect collective bargaining rights , Norway sovereign wealth fund says"
45,2023-12-08 15:15:00,Futures : Jobs Report Due ; Tesla China Sales Bounce
49,2023-12-08 15:15:00,Bernstein best idea for 2024 ? Short Tesla stock
156,2023-12-08 17:15:00,Major Tesla competitor latest move looks bad for the electric vehicle industry
108,2023-12-08 22:00:00,"Tesla Inc . stock rises Friday , outperforms market"
50,2023-12-09 00:00:00,Just 3 of the  Magnificent Seven  Have Outperformed the S & P 500 Since 2022 . Here the One Id Buy for 2024 and 2025
183,2023-12-09 10:15:00,Tesla says California agency implicitly approved of its  Autopilot  brand
28,2023-12-09 16:00:00,"Electric vehicles 2024 and beyond : Why Tesla , BYD and Rivian may lap the field"
98,2023-12-09 16:15:00,3 Growth Stocks Redefining Industry Standards
201,2023-12-09 18:00:00,6 Reasons To Avoid Tesla Model X No Matter What
13,2023-12-10 16:45:00,"Tesla Stock to Drop 40 % in 2024 , According to This Analyst"
75,2023-12-10 23:30:00,This 2024 Rule Change Could Crush Tesla Stock
222,2023-12-11 13:30:00,Can Tesla Stock Hit $500 in 2024 ? | The Motley Fool
221,2023-12-11 14:15:00,Can Tesla Stock Hit $500 in 2024 ? | The Motley Fool
111,2023-12-11 22:00:00,"Tesla Inc . stock falls Monday , underperforms market"
133,2023-12-11 23:45:00,Dow Jones Futures : Magnificent Seven Stocks Slide ; AI Giant Oracle Dives On Earnings ; CPI Next
129,2023-12-11 23:45:00,"Markets News , Dec . 11 , 2023 : Indexes Rebound to Fresh Highs ; Chip Stocks Surge and Crypto Tumbles"
15,2023-12-12 13:00:00,"Here what hit the Magnificent 7 stocks , and why the selling may continue . "
51,2023-12-12 13:15:00,"Need to Know : Here what hit the Magnificent 7 stocks , and why the selling may continue"
99,2023-12-12 15:00:00,"Tesla says it is  morally obligated  to continue improving Autopilot , reiterates safety claims"
147,2023-12-12 15:15:00,Ford Halves Its F150 Lightning Production Target For 2024
40,2023-12-13 00:00:00,Nvidia Stock : Game Over Or Game On In 2024 ? 
175,2023-12-13 00:30:00,Dow Jones Rises As Fed Decision Looms ; Google Nicked By Antitrust Verdict
41,2023-12-13 01:30:00,Nvidia Stock : Game Over Or Game On In 2024 ? 
196,2023-12-13 01:30:00,"Tesla says it is  morally obligated  to continue improving Autopilot , reiterates safety claims"
246,2023-12-13 04:15:00,"Tesla Responds To Safety Worries Over Cybertruck Design , Says Size Doesnt Matter When It Comes To  Crumple Zone  - Tesla ( NASDAQ : TSLA ) "
177,2023-12-13 06:00:00,Tesla Receives Land - Use Permits For Gigafactory In Mexico Nueva Leon
223,2023-12-13 14:00:00,Where Will Tesla Be in 10 Years ? | The Motley Fool
93,2023-12-13 16:30:00,"MicroStrategy , Block will get to capture token highs , lows under new FASB rules"
227,2023-12-13 16:45:00,Nio Stock Forecast : NIO continues descent after Ford cuts electric F - 150 production
178,2023-12-13 16:45:00,Tesla Swedish Struggle Rises ! Union Reportedly Halts Waste Collection Amid Rally For Employee Rights
66,2023-12-13 18:15:00,Elon Musk hits back at critics with impressive new Tesla Bot video
160,2023-12-13 19:00:00,"X wild , messy 2023 and what next"
4,2023-12-13 20:15:00,Tesla new Autopilot safeguards could set it up for a smoother regulatory ride ahead
132,2023-12-13 20:45:00,"Ventas , Inc . ( VTR ) Stock Forecasts"
195,2023-12-13 22:30:00,"Photronics , Vertex rise ; Pfizer , Southwest Airlines fall , Wednesday , 12 / 13 / 2023"
229,2023-12-14 03:15:00,Tesla offers new discounts on electric vehicles with conditions
197,2023-12-14 07:45:00,"Tesla Teams Up With Uber , Offer Drivers Up To $3K in Savings On Electric Cars"
173,2023-12-14 14:45:00,3 Things You Need to Know If You Buy Tesla Today
153,2023-12-14 17:30:00,Auto recovery set to continue in 2024 with 88 . 3M in sales projected
53,2023-12-14 18:00:00,The Year Ahead : Here why Tesla is facing a  lower - growth period  in the new year
150,2023-12-14 19:00:00,Baystreet . ca - Markets Are Shaking Up These Stocks
152,2023-12-14 20:00:00,"Massive News for Ford Stock , Tesla Stock , and Rivian Stock Investors ! "
97,2023-12-14 21:15:00,"Tesla luxury rival unveils a big , new electric family cruiser"
172,2023-12-14 21:30:00,Here why Tesla is facing a  lower - growth period  in the new year
61,2023-12-14 22:00:00,Jeff Bezos thinks Elon Musk must be a  very capable leader  
90,2023-12-14 22:15:00,Electric SUV and crossover sales are booming . One model is driving most of the surge
162,2023-12-15 01:45:00,Cadillac is rolling out a brand new Tesla competitor
102,2023-12-15 03:15:00,Why Tesla Stock Triumphed Today | The Motley Fool
226,2023-12-15 14:15:00,S & P 500 : 3 Of The  Magnificent  Seven Are Actually  Devastating  Losers
62,2023-12-15 15:15:00,3 Of The  Magnificent  Seven Are Actually  Devastating  Losers
113,2023-12-15 20:45:00,3 Blue - Chip Stocks I Wouldnt Touch With a 10 - Foot Pole
112,2023-12-15 22:00:00,"Tesla Inc . stock rises Friday , outperforms market"
47,2023-12-16 00:30:00,Can the Magnificent Seven continue to dominate in 2024 ? 
52,2023-12-16 00:30:00,Has The Electric Car Battery Boom Faded ? 
60,2023-12-16 14:45:00,Luxury automaker terminates top - selling car sooner than expected
247,2023-12-16 17:45:00,Elon Musk says oil and gas should not be demonised
106,2023-12-16 18:30:00,Electric Vehicle Subsidies : Germany Ends EV Bonus Abruptly In Latest Blow To Tesla
219,2023-12-17 03:00:00,Can Tesla Stock Hit $380 in One Year ? Here What Morgan Stanley Expects
63,2023-12-17 16:45:00,Germany Ends EV Subsidies In Latest Blow To Tesla
14,2023-12-17 17:00:00,Exciting News for Tesla Stock Investors
104,2023-12-17 17:30:00,Nissan to export China - developed EVs
35,2023-12-17 19:00:00,Unfortunate News for Tesla Stock Investors
220,2023-12-17 22:00:00,Elon Musk says fossil fuels shouldnt be shunned amid green transition ( NASDAQ : TSLA ) 
116,2023-12-18 12:00:00,"Nio Stock Jumps On China EV Maker Landmark 1 , 000 - Kilometer Drive , Abu Dhabi Investment"
193,2023-12-18 16:45:00,Dow Jones Holds Record Highs After Economic Data ; Tesla Rival Wins $2 Billion Deal
38,2023-12-18 16:45:00,Nio stock jumps as Abu Dhabi investor to pour in $2 . 2 billion
84,2023-12-18 17:30:00,Top investor explains the one reason Tesla stock is off its all - time high
64,2023-12-18 18:00:00,"Magnificent Seven Stocks To Buy And Watch : Apple , Nvidia , Tesla In Buy Areas"
127,2023-12-18 18:00:00,Key Tesla rival gets $2 . 2 billion investment
67,2023-12-18 20:00:00,A former Tesla executive new venture brings EV technology beyond roads
101,2023-12-18 23:15:00,Tesla is working on a revolutionary new form of tech
239,2023-12-19 00:15:00,Tesla rival faces growing bankruptcy risk
121,2023-12-19 00:30:00,Key Tesla rival gets $2 . 2 billion investment
155,2023-12-19 01:30:00,Acura introduces new $60K Tesla competitor
237,2023-12-19 02:00:00,Elon Musk Pledges $100M to Launch an Austin - Based University
115,2023-12-19 03:30:00,"Nio Stock Jumps On China EV Maker Landmark 1 , 000 - Kilometer Drive , Abu Dhabi Investment"
244,2023-12-19 06:15:00,Nissan to export China - developed EVs to global markets
122,2023-12-19 06:15:00,Tesla challenger Nio gets $2 . 2 billion investment from Abu Dhabi CYVN
123,2023-12-19 07:00:00,Tesla challenger Nio gets $2 . 2 billion investment from Abu Dhabi CYVN
91,2023-12-19 09:00:00,Nio EVs maker gains USD2 . 2B investment from CYVN Holdings in Abu Dhabi
68,2023-12-19 10:15:00,Has The Electric Car Battery Boom Faded ? 
164,2023-12-19 13:30:00,5 Things to Know Before The Stock Market Opens
245,2023-12-19 16:15:00,2 Electric Vehicle Stocks You Can Buy Right Now Before They Surge Even Higher
76,2023-12-19 16:45:00,Elon Musk says the Tesla Cybertruck will be able to double as a boat
165,2023-12-19 17:30:00,Elon Musk Tesla responds strongly to UAW auto union threat
239,2023-12-19 19:45:00,"Embarrassing Tesla Cybertruck Video Gleans Response From Forest Service , But Was It A Diss ? "
8,2023-12-19 21:15:00,Elon Musk says the Tesla Cybertruck will be able to double as a boat
134,2023-12-19 22:00:00,Apple Stock Among Magnificent Seven Stocks Funds Are Buying | Investor Business Daily
110,2023-12-19 22:15:00,"Tesla Inc . stock rises Tuesday , outperforms market"
85,2023-12-20 00:00:00,Huffin  Hazelnut
101,2023-12-20 01:00:00,One Wall Street analyst thinks Tesla stock will crash nearly 50 %. Should you wait to buy the dip ? 
97,2023-12-20 16:30:00,Tesla Stock Merit Awards Off The Table Even As Shares Have Doubled In 2023
12,2023-12-20 18:00:00,Winners and losers from Edmund test of electric vehicle charging times ( NYSE : GM ) 
217,2023-12-20 22:15:00,"Cathie Wood , Elon Musk To Talk AI , Space And More On X Spaces This Week"
6,2023-12-21 13:45:00,Cathie Wood ETFs are now buying Tesla stock
43,2023-12-21 16:45:00,Jeff Bezos reveals his bizarre meeting rules ( it involves pizza ) 
74,2023-12-21 17:00:00,These were the top tickers on Stocktwits in 2023
113,2023-12-21 17:45:00,Cathie Wood pours $27 . 5 million into Tesla ; first purchase of EV firm in months
184,2023-12-21 18:30:00,These were the top tickers on Stocktwits in 2023
99,2023-12-21 19:30:00,Elon Musk Feud With Disney CEO Bob Iger Spills Over to Tesla
16,2023-12-21 22:00:00,Purpose Investments Inc . Announces Correction to Annual Capital Gain Distribution Rate for Tesla ( TSLA ) Yield Shares Purpose ETF
31,2023-12-21 22:00:00,"RBC Capital Cuts Tesla ( TSLA ) Delivery Numbers ,  Big Push into Quarter End Creates Uncertainty  "
114,2023-12-21 23:00:00,Jim Cramer identifies what separates the Magnificent 7 from the rest
23,2023-12-21 23:00:00,Purpose Investments Inc . Announces Correction to Annual Capital Gain Distribution Rate for Tesla ( TSLA ) Yield Shares Purpose ETF
196,2023-12-21 23:00:00,Tesla Faces Probe In Norway Over Suspension Failure In EV Cars
42,2023-12-22 00:30:00,Cathie Wood Buys Tesla Stock For First Time In 8 Months As Tesla Faces Possible Recall
106,2023-12-22 12:15:00,BYD will open its first European EV production facility
1,2023-12-22 12:15:00,"Tesla roundup : Megapack plant in China , U . S . recall , visions of one trillion market cap"
94,2023-12-22 12:15:00,Tesla moves forward with a plan to build an energy - storage battery factory in China
95,2023-12-22 13:00:00,"Tesla stock can rise to $1 trillion market value in 2024 , analyst says"
191,2023-12-22 13:15:00,A Game - Changing Move for Tesla ? One Catalyst That Could Supercharge TSLA Stock in 2024
68,2023-12-22 15:30:00,BYD To Build EV Plant In Hungary As Tesla Rival Expands
24,2023-12-22 20:30:00,"Catalyst Watch : NIO event , Nevada casino numbers and Tesla deliveries watch"
127,2023-12-22 21:45:00,Best EV Stock to Buy in 2024 : Tesla Stock vs . Nio Stock
170,2023-12-23 02:00:00,Here the latest sector to fall to the country unionization fever
246,2023-12-23 11:30:00,More Good News for Rivian Investors -- at Tesla Expense
108,2023-12-23 13:30:00,Nio Day 2023 : China EV Maker Unveils Super - Premium ET9 Sedan | Investor Business Daily
124,2023-12-23 15:45:00,"Tesla recalls over 120 , 000 cars over door risks"
125,2023-12-23 16:30:00,"Tesla recalls over 120 , 000 cars over door risks"
126,2023-12-23 17:00:00,"Tesla recalls over 120 , 000 cars over door risks"
240,2023-12-23 17:15:00,"Tesla recalls over 120 , 000 cars over door risks"
198,2023-12-24 00:30:00,"Tesla recalls over 120 , 000 cars over door risks"
55,2023-12-24 10:15:00,Nio Unveils Super - Premium ET9 Sedan
168,2023-12-24 12:00:00,QuantumScape in 2024 : Is This the Year It Starts Making Money ? 3 Ways It Could Happen
11,2023-12-24 12:15:00,QuantumScape in 2024 : Is This the Year It Starts Making Money ? 3 Ways It Could Happen
132,2023-12-24 16:15:00,"Tesla recalls over 120 , 000 cars over door risks"
133,2023-12-24 17:30:00,"Tesla recalls over 120 , 000 cars over door risks - ABC7 San Francisco"
199,2023-12-24 19:30:00,There May Be a Price War Coming for Electric Vehicles . Here Why Rivian Can Win It
128,2023-12-24 19:30:00,"Tesla recalls over 120 , 000 cars over door risks - ABC11 Raleigh - Durham"
129,2023-12-24 20:00:00,"Tesla recalls over 120 , 000 cars over door risks"
220,2023-12-25 01:00:00,There May Be a Price War Coming for Electric Vehicles . Here Why Rivian Can Win It . 
71,2023-12-25 05:00:00,3 Growth Stocks Set to Reach $1 Trillion Status
134,2023-12-25 16:15:00,Best AI Stocks 2024 : Tesla Stock vs . Nvidia Stock
200,2023-12-25 18:00:00,Best AI Stocks 2024 : Tesla Stock vs . Nvidia Stock
206,2023-12-26 08:00:00,"  Good Design , Says Elon Musk After Tesla Fan Shares Wishlist For  Futuristic  $25K Compact EV - Tesla ( NASDAQ : TSLA ) "
189,2023-12-26 12:00:00,Tesla Stock Rebounds From Pre - Christmas Session Losses : What Driving The Upside ? - Tesla ( NASDAQ : TSLA ) 
219,2023-12-26 13:00:00,1 Massive Change in 2024 That Tesla Investors Must Know About
223,2023-12-26 14:45:00,"China EV Registrations Show Race To Finish For Li Auto , Nio , XPeng , BYD"
188,2023-12-26 15:00:00,"Japanese Auto Giants Invest Billions in Thailand Electric Future - Report - Isuzu Motors ( OTC : ISUZY ), Tesla ( NASDAQ : TSLA ), Toyota Motor ( NYSE : TM ), Mitsubishi Motors ( OTC : MMTOF ) "
33,2023-12-26 16:30:00,Piper Sandler remains Overweight on Tesla ( TSLA ) ahead of 4Q delivery report
209,2023-12-26 17:00:00,Tesla Bull Raises Price Target for 2024 as Tesla Enters Next Phase of Growth
116,2023-12-26 17:00:00,5 Things to Know Before The Stock Market Opens
87,2023-12-26 19:00:00,Plug Into Profits : 3 EV Charging Stocks to Buy as 2023 Ends
222,2023-12-26 19:00:00,Tesla higher as Morgan Stanley sees AI potential offsetting margin pressure
234,2023-12-26 21:15:00,Tesla higher as Morgan Stanley sees AI potential offsetting margin pressure
49,2023-12-26 22:15:00,Tesla stock ( TSLA ) gets boost from  beyond an automaker  scenario
56,2023-12-27 09:15:00,"Cathie Wood talks Tesla , Elon Musk , & spot bitcoin ETF approval"
15,2023-12-27 12:30:00,Tesla to launch revamped Model Y from Shanghai plant amid rising competition - report
192,2023-12-27 12:30:00,"Tesla Makes Money Selling Electric Vehicles , But 67 % of Its Earnings Might Soon Come From This Instead"
221,2023-12-27 13:45:00,"Tesla deliveries to hit another quarterly record , but fall short of Elon Musk aspirations"
34,2023-12-27 14:15:00,Wedbush reiterates Outperform ahead of Tesla ( TSLA ) 4Q delivery report
58,2023-12-27 14:15:00,"Tesla deliveries to hit another quarterly record , but fall short of Elon Musk aspirations"
161,2023-12-27 14:45:00,Tesla Stock : EV Giant Reportedly Plans Model Y Refresh In China For 2024
183,2023-12-27 14:45:00,Can Tesla Stock Hit $300 in 2024 ? | The Motley Fool
18,2023-12-27 14:45:00,"4 stocks to watch on Wednesday : Iovance Biotherapeutics , NetEase and more ( NASDAQ : IOVA ) "
117,2023-12-27 17:00:00,5 Things to Know Before The Stock Market Opens
57,2023-12-27 18:45:00,Tesla factory worker had a bloody encounter with Texas Gigafactory robot
224,2023-12-27 19:00:00,Tesla factory worker had a bloody encounter with Texas Gigafactory robot
82,2023-12-27 19:00:00,Why Blink Charging Stock Lost Its Charge Today
235,2023-12-27 20:00:00,Tesla factory worker had a bloody encounter with Texas Gigafactory robot
162,2023-12-27 21:45:00,Tesla Stock Clears Early Entry On Reported Plans To Refresh Model Y For China In 2024
130,2023-12-27 21:45:00,Dow Jones Rallies On ; 6 Magnificent Seven Stocks Near Buy Points Headed Into 2024
83,2023-12-27 22:00:00,"Tesla Inc . stock rises Wednesday , outperforms market"
187,2023-12-27 22:45:00,Chinese Tesla rival launches fast - charging electric vehicle
201,2023-12-28 10:30:00,"Chinese Smartphone Giant Xiaomi Enters Electric Vehicle Market , Targets Tesla , Porsche With SU7"
123,2023-12-28 16:00:00,Smartphone giant targets Tesla and Porsche with huge new unveiling
167,2023-12-28 20:00:00,"Forget The Magnificent 7 : Did Anyone Back These 1 , 000 % Gainers In 2023 ? - Applied Optoelectronics ( NASDAQ : AAOI ), Amazon . com ( NASDAQ : AMZN ) "
50,2023-12-28 20:15:00,This Is How Elon Musk Got Rich
233,2023-12-28 21:00:00,Elon Musk fires back at  truly shameful  media report on Tesla Gigafactory worker injury
84,2023-12-28 22:45:00,"Tesla Inc . stock falls Thursday , underperforms market"
59,2023-12-29 13:30:00,Futures : S & P 500 Near High ; Tesla Falls Below Buy Point
160,2023-12-29 15:30:00,5 Things to Know Before The Stock Market Opens
19,2023-12-29 16:45:00,"Tesla Deliveries , Jobs Report Kick Off 2024 First Investing Action Plan"
5,2023-12-30 00:30:00,"2023 Stock Market News : Inflation , AI , Big Techs Shape Rebound"
45,2023-12-30 10:45:00,100 Best Stocks 2023 : Nvidia Among 4 Magnificent Seven Stocks Listed
51,2023-12-30 10:45:00,"2023 Stock Market News : Inflation , AI , Big Techs Shape Rebound"
115,2023-12-30 13:30:00,Stocks closed 2023 near record highs . Here what Wall Street thinks is coming in 2024 . 
232,2023-12-30 13:30:00,Stocks To Watch : Economic Releases Headline First Week of 2024
112,2023-12-30 14:15:00,Where Will Tesla Stock Be in 2024 ? 
21,2023-12-30 15:00:00,These are the largest publicly - traded companies in each US state
52,2023-12-30 16:00:00,"2023 Stock Market News : Inflation , AI , Big Techs Shape Rebound"
22,2023-12-30 17:00:00,These are the largest publicly - traded companies in each US state
210,2023-12-30 20:15:00,Where Will Tesla Stock Be in 2024 ? 
75,2023-12-31 12:45:00,  They have this kind of incredible power : Almost 75 % of S & P 500 stocks under - performed in 2023 but here are 3  magnificent  companies that bucked the trend and beat the market
7,2024-01-01 20:45:00,2024 electric vehicle jolt - fewer models qualify for the full tax credit ( NASDAQ : TSLA ) 
186,2024-01-02 02:00:00,"More EVs lose US tax credits including Tesla , Nissan , GM vehicles"
105,2024-01-02 12:15:00,Wall Street Breakfast Podcast : Fewer EV Models Qualify
100,2024-01-02 14:00:00,Tesla extends lead in Norway as EVs take record 82 % market share
60,2024-01-02 15:15:00,"Tesla tops fourth - quarter delivery estimates , surpasses 2023 target"
48,2024-01-02 16:00:00,Stocks Fall As Apple Slides On Downgrade
204,2024-01-02 16:00:00,"Tesla , GM , Ford : New Rules Disqualify EVs From U . S . Tax Credits"
155,2024-01-02 18:00:00,Baystreet . ca - China BYD Surpasses Tesla To Become World Top EV Producer
140,2024-01-02 18:00:00,Baystreet . ca - What Happens in 2024 After S & P 500 Returned 25 % 
228,2024-01-02 18:45:00,"Tesla : Buy , Sell , or Hold ? | The Motley Fool"
169,2024-01-02 21:45:00,Why these key investors believe the tech bull market has begun
121,2024-01-02 22:00:00,"Magnificent Seven Stocks In 2024 Like Nvidia , Meta : Ready To Rock On Or Roll Over ? "
205,2024-01-02 22:45:00,"Elon Musk Confirms Tesla Hid  Easter Egg  In Cybertruck After Customer Found This Hidden Feature , Freaked Out"
226,2024-01-02 23:00:00,China BYD is selling more EVs than Tesla
195,2024-01-03 03:30:00,Canaccord Genuity Bullish On Tesla In The Long - Term :  Tesla Is Apple On Steroids ... - Tesla ( NASDAQ : TSLA ) 
227,2024-01-03 13:30:00,3 AI Stocks on Track to Be Trillion - Dollar Companies
120,2024-01-03 14:00:00,5 Things to Know Before The Stock Market Opens
185,2024-01-03 15:00:00,Stocks Start 2024 On Shaky Ground
172,2024-01-03 15:15:00,Mega - cap companies saw strong gains in 2023 amid tech optimism | Hellenic Shipping News Worldwide
61,2024-01-03 16:45:00,"Tesla : Buy , Sell , or Hold ? "
215,2024-01-03 16:45:00,"Musk , Zuckerberg See Net Worth Soar In 2023 As Billionaire Rivalry Continues To Play Out"
122,2024-01-03 18:15:00,"Tesla stock falls again , toward longest losing streak in a month"
243,2024-01-03 21:15:00,Tesla luxury rival lowers prices to grab electric vehicle buyers
69,2024-01-04 02:00:00,Wall Street Wobbles $NVDA $TSLA $GOOGL $META $AMZN
53,2024-01-04 11:30:00,"Ark Invest Sells $25M Coinbase Shares To Buy Elon Musk Tesla ( TSLA ), Cathie Wood Still Bearish"
214,2024-01-04 13:45:00,Tesla Triumphs and Trials : TSLA Stock Outlook for 2024
102,2024-01-04 14:15:00,"Cathie Wood Buys Tesla Stock , Unloads COIN Shares Amid Market Turbulence"
146,2024-01-04 14:15:00,MSFT Stock : It The Only Long - Term Leader Among Magnificent Seven Stocks
62,2024-01-04 16:00:00,Cathie Wood pours $25 million into Tesla following record 2023 car sales
174,2024-01-04 17:00:00,Baystreet . ca - 5 Stocks Unwinding Fast This Morning
13,2024-01-04 18:30:00,"ARK Invest sells another 166 , 000 Coinbase shares worth $25M"
225,2024-01-04 18:45:00,Cathie Wood Is Buying Up Tesla ( TSLA ) Stock
67,2024-01-04 18:45:00,"Magnificent Seven stocks fall , but investors are snapping up bonds"
88,2024-01-04 22:00:00,Tesla Inc . stock outperforms market despite losses on the day
36,2024-01-05 02:15:00,"Short sellers lost $195 billion in 2023 bets against US , Canadian stocks : S3"
197,2024-01-05 09:15:00,Samsung Announces Integration With Tesla For Smartthings Energy At CES 2024 : What You Need To Know
237,2024-01-05 10:45:00,Tesla Recalls 1 . 6M Vehicles In China Over Autosteer Concerns Just Weeks After Massive US Callback - Tesla ( NASDAQ : TSLA ) 
8,2024-01-05 11:15:00,Tesla to recall 1 . 62M vehicles in China ( NASDAQ : TSLA ) 
173,2024-01-05 12:15:00,"Baystreet . ca - Watch QuantumScrape , Coinbase , Mobileye , Walgreens , and More"
230,2024-01-05 14:15:00,Tesla recalls 1 . 6 million cars in China to reduce risk of collisions
182,2024-01-05 14:15:00,Tesla ( TSLA ) recalls 1 . 62M units in China
70,2024-01-05 15:00:00,Tesla recalls 1 . 6 million cars in China to reduce risk of collisions
91,2024-01-05 15:45:00,Tesla recalls 1 . 6 million cars in China to reduce risk of collisions
153,2024-01-05 16:00:00,Apple slides on Foxconn outlook as Microsoft nears market - cap takeover
111,2024-01-05 16:00:00,"Three Stocks : Ringing Up a Great December , Another Day , Another Recall , and Analyst Trash Talks Old School AI"
65,2024-01-05 17:30:00,"Tesla to recall 1 . 6 million cars in China to fix autopilot , reduce risk of collision"
72,2024-01-05 18:15:00,"Tesla recalls 1 . 6 million cars in China to reduce risk of collisions - Boston News , Weather , Sports"
178,2024-01-05 18:15:00,"Stock Market Skids To Start 2024 As Tesla , Apple Stumble , Mobileye Crashes : Weekly Review"
179,2024-01-05 20:15:00,"Stock Market Skids To Start 2024 As Tesla , Apple Stumble , Mobileye Crashes : Weekly Review"
231,2024-01-05 20:30:00,"Tesla to recall 1 . 6 million cars in China to fix autopilot , reduce risk of collision"
86,2024-01-05 20:30:00,Tesla is issuing a massive recall in one of its key markets
229,2024-01-05 22:30:00,Tesla Stock Tests Support As EV Giant Cuts Vehicle Range Estimates In The U . S . 
141,2024-01-06 07:00:00,Baystreet . ca - Stock News Today : These Stocks Will Shake Off Dismal 2024 Start
207,2024-01-06 08:30:00,Fisker leans on dealerships to boost EV sales
176,2024-01-06 14:00:00,4 Trends To Watch For In 2024
10,2024-01-06 17:00:00,Some electric vehicles are underperforming EPA range estimates
46,2024-01-06 19:45:00,"VinFast To Build India EV Plant , Invest $2 Billion ; Founder Returns As CEO"
80,2024-01-07 12:00:00,Huge News for Tesla Stock Investors
136,2024-01-07 13:15:00,Stocks Decline And Fed Rate Cuts Imperiled To Begin 2024
156,2024-01-07 14:00:00,Will Elon Musk Drug Use Hurt Tesla ? 
163,2024-01-07 14:00:00,Huge News for Tesla Stock Investors
4,2024-01-07 19:30:00,Starting 2024 on the Wrong Foot . What Happened to Tesla Last Week ? 
28,2024-01-08 18:15:00,Elon Musk denies any drug use following a scathing WSJ report
190,2024-01-08 22:45:00,How the Largest Stock Funds Performed In 2023
157,2024-01-08 22:45:00,"Forget Ford Stock , Buy This Instead For 2024 and Beyond"
137,2024-01-09 21:30:00,Sony and Honda new EV is an AI - powered wake up call for Tesla
151,2024-01-09 23:15:00,Stock Market Today : Stocks End Mixed After Tech - Fueled Rally
143,2024-01-10 01:00:00,Sony and Honda new EV is an AI - powered wake up call for Tesla
139,2024-01-10 05:45:00,You Can Finally Order Tesla New Model 3 In America : Here Its Starting Price - Tesla ( NASDAQ : TSLA ) 
158,2024-01-10 10:45:00,Here Why Investors Should Dump TSLA Stock ASAP
149,2024-01-10 13:30:00,Will the  Magnificent Seven  or the FAANG Stocks Have a Better 2024 ? 
238,2024-01-10 17:45:00,Upgraded version of one of Tesla most popular models is now available in the U . S . 
