,dt,title
163,2023-06-22 17:15:00,"Elon Musk and Mark Zuckerberg seemingly agree to a cage match , and weve reached peak absurdity"
161,2023-06-22 17:30:00,"Elon Musk and Mark Zuckerberg seemingly agree to a cage match , and weve reached peak absurdity"
185,2023-06-22 21:00:00,Lucid Stock Hits New Low . It Might Be the Tesla Charger . 
195,2023-06-22 23:00:00,"Elon Musk and Mark Zuckerberg say theyre ready for a cage fight - WSVN 7News | Miami News , Weather , Sports"
90,2023-06-23 00:00:00,S & P 500 and Nasdaq Snap 3 - Day Losing Streak as Tech Stocks Advance
217,2023-06-23 06:45:00,"Investor Sentiment Improves After Nasdaq Snaps 3 - Session Losing Streak - Apple ( NASDAQ : AAPL ), Apogee Enterprises ( NASDAQ : APOG ) "
248,2023-06-23 16:00:00,2 Hot Growth Stocks Investors Should Avoid
70,2023-06-23 18:00:00,"Tesla Proves Electric Engines Can Run Hot , Too"
106,2023-06-23 21:00:00,"Tesla Inc . stock falls Friday , underperforms market"
195,2023-06-24 15:15:00,Tesla Has a Peculiar Problem - The Globe and Mail
166,2023-06-24 20:45:00,"Musk , Zuckerberg talk cage match in social media bluster"
43,2023-06-25 00:15:00,Elon Musk Gives the World a Reason to Be Excited
33,2023-06-25 21:00:00,Tesla Rival Rivian Finally Has Good News on Its Electric Vehicles
88,2023-06-26 09:45:00,"Tesla stock drops again after Goldman Sachs downgrades , as yet another Wall Street firm slashes rating"
181,2023-06-26 12:00:00,Tesla Stocks Extends Slide As Goldman Downgrade Adds to Wall Street Margin Worries
219,2023-06-26 13:00:00,The Average S & P 500 Stock Is Only Up 3 % So Far in 2023
245,2023-06-26 13:15:00,Lucid Group Stock News : LCID jumps nearly 10 % after announcing Aston Martin partnership
177,2023-06-26 13:45:00,5 Things to Know Before Markets Open
35,2023-06-26 17:30:00,"Tesla deliveries could bring upside , with Deutsche Bank flagging China strength"
23,2023-06-26 18:30:00,Markets Little Changed Midday to Start the Last Trading Week of 2023 First Half
96,2023-06-26 20:00:00,Lucid Stock Pops Off Lows On EV Deal With British Luxury Icon ; Startup Peer Nikola Sinks
199,2023-06-26 21:30:00,Why Tesla Stock Fell Today | The Motley Fool
178,2023-06-26 22:00:00,"Tesla investors should pump the brakes on Supercharger enthusiasm , one bear says"
22,2023-06-26 23:30:00,Markets Open Last Week of Q2 in the Red as Tech Stocks Slide
34,2023-06-26 23:30:00,"The Ratings Game : Tesla investors should pump the brakes on Supercharger enthusiasm , one bear says"
66,2023-06-27 00:15:00,"S & P 500 : Carnival , Tesla Headline Big - Cap Losers Monday"
97,2023-06-27 01:45:00,Lucid Stock Rallies Off Lows On EV Deal With British Luxury Icon ; Startup Peer Nikola Sinks
241,2023-06-27 11:30:00,"Tesla shares bounce higher after Monday decline , Lordstown stock plunges on bankruptcy filing , and other stocks on the move"
2,2023-06-27 11:45:00,Is Tesla Stock a Buy Now ? Tesla Stock Analysis
240,2023-06-27 12:15:00,ChargePoint Stock Rises After It Adopts Tesla EV Plug
51,2023-06-27 12:15:00,"Tesla shares bounce higher after Monday decline , Lordstown stock plunges on bankruptcy filing , and other stocks on the move"
128,2023-06-27 13:30:00,"Big Tech Has Been Impressive , but This Homebuilder ETF Has Nailed It , Too"
207,2023-06-27 16:30:00,GM CEO Says New Deal Saved the Company $400 Million
111,2023-06-27 18:00:00,Almost Half of Consumers Planning to Buy an EV Citing Improved Vehicle Performance
20,2023-06-27 19:00:00,Lordstown banktrupcy points to EV hype that doesnt deliver
152,2023-06-27 19:15:00,Ford Is Laying Off Engineers . Theses Stocks Could Benefit . 
109,2023-06-27 22:00:00,"Tesla Inc . stock rises Tuesday , outperforms market"
47,2023-06-27 22:00:00,Lordstown bankruptcy points to EV hype that didnt deliver
95,2023-06-27 22:45:00,Markets Rise on Positive News about Consumer Confidence and Travel Demand
239,2023-06-28 16:00:00,U . S . Stocks Turn Mixed After Seeing Initial Weakness
179,2023-06-28 19:45:00,"Why Rivian , Fisker , and Lucid Stocks Powered Higher Today"
238,2023-06-28 20:45:00,U . S . Stocks Close Mixed Following Lackluster Session
247,2023-06-28 21:00:00,U . S . Stocks Close Mixed Following Lackluster Session
108,2023-06-28 21:15:00,"Tesla Inc . stock rises Wednesday , outperforms market"
246,2023-06-29 13:15:00,Baystreet . ca - Volvo Strikes Deal To Access Tesla Charging Network
242,2023-06-29 19:00:00,S & P 500 : Cathie Wood Is Back On Top Thanks To 8 Stocks Not In The S & P 500
39,2023-06-29 19:30:00,The next catalyst for Tesla stock is around the corner
21,2023-06-29 20:00:00,"Polestar to adopt Tesla supercharger network in the US , Canada"
125,2023-06-29 21:00:00,"Tesla Inc . stock rises Thursday , outperforms market"
65,2023-06-29 23:30:00,Why Rivian Stock Zoomed 9 % Higher Today
64,2023-06-30 00:30:00,Why Rivian Stock Zoomed 9 % Higher Today
249,2023-06-30 12:00:00,Want Your Tesla Cybertruck In Black Matte Or Blue Satin ? This Company Gives You 100 Wrap Options - Tesla ( NASDAQ : TSLA ) 
144,2023-07-01 01:30:00,Apple shares hit new all - time intraday and closing highs
164,2023-07-02 16:00:00,Elon Musk Imposes Strict Twitter  Rate Limit  Curbs On Users
213,2023-07-02 20:45:00,Top Cathie Wood Stock Expected To Deliver 772 % Earnings Growth . It Flashing A Buy Signal . 
193,2023-07-02 21:30:00,Tesla Q2 Vehicle Deliveries Up 83 % 
137,2023-07-02 21:45:00,"Tesla beats second - quarter estimates with deliveries of 466 , 000 vehicles"
210,2023-07-02 23:00:00,"BYD Beat Tesla in China in Q2 . This Is a Two Horse Race , Though . "
229,2023-07-03 05:00:00,"Morning Bid : Tesla delivers surprise , China goes slow"
124,2023-07-03 09:45:00,"Tesla , Agilent , Palantir , Sabre , and More Stock Market Movers"
212,2023-07-03 10:15:00,"BYD Beat Tesla in China in Q2 . This Is a Two - Horse Race , Though . "
11,2023-07-03 10:30:00,An Industry Tesla May Struggle to Dominate ( and a Better Stock to Buy Instead ) 
105,2023-07-03 12:30:00,Tesla smashed it last quarter but China BYD did even better
36,2023-07-03 12:45:00,Tesla smashed it last quarter but China BYD did even better
211,2023-07-03 13:45:00,"BYD Beat Tesla in China in Q2 . This Is a Two - Horse Race , Though . "
40,2023-07-03 13:45:00,"S & P 500 Futures Flat in Premarket Trading ; Fidelity National , Tesla Lead"
191,2023-07-03 15:00:00,"Top 5 Consumer Stocks That May Implode This Quarter - Ford Motor ( NYSE : F ), Li Auto ( NASDAQ : LI ) "
119,2023-07-03 19:15:00,Tesla shares rise on strong sales report
171,2023-07-03 19:45:00,Tesla shares rise on strong sales report
230,2023-07-03 20:00:00,"Wall St ends slightly higher in shortened session , Tesla jumps"
69,2023-07-03 23:30:00,"China EV Sales Improve For Nio And Xpeng , While BYD And Li Auto Boom And Hit Milestones"
52,2023-07-04 10:00:00,Stock Market News Today : Markets post slight gains in shortened trading session ( SP500 ) 
57,2023-07-04 13:00:00,Tesla and BYD hit record deliveries of China - made vehicles in second - quarter
189,2023-07-04 14:15:00,Tesla and BYD hit record deliveries of China - made vehicles in second - quarter
122,2023-07-05 06:00:00,Morning Bid : China dampens the mood again
120,2023-07-05 06:30:00,Tesla China deliveries account for more than half of global sales
170,2023-07-05 08:45:00,Tesla China deliveries account for more than half of global sales
163,2023-07-05 09:15:00,Musk - Zuckerberg Cage Fight Is a Distraction . What Actually Matters . 
209,2023-07-05 12:00:00,5 Things to Know Before Markets Open
38,2023-07-05 13:30:00,Tesla and BYD Were First . Volvo Cars Posts Huge Spike in Electric Vehicle Sales . 
162,2023-07-05 17:45:00,"GM Delivered a Lot More Cars , but Fewer EVs . The Stock Is Up . "
214,2023-07-05 17:45:00,Tesla Model Y Outpaces 35 - Year - Old Record For Car Sales In Iceland - Tesla ( NASDAQ : TSLA ) 
161,2023-07-05 17:45:00,Chinese Sales Power Another Delivery Record for Tesla
123,2023-07-05 22:00:00,Germany Scholz hints at more chip investments
84,2023-07-05 22:00:00,"Tesla Inc . stock rises Wednesday , outperforms market"
136,2023-07-05 22:15:00,3 High Growth Stocks Surging in 2023
12,2023-07-06 01:00:00,Best Stocks to Buy Now : Rivian Stock vs . Tesla Stock
139,2023-07-06 14:45:00,StreetInsider . com
190,2023-07-06 16:00:00,"Tesla , BYD Call Truce In EV Price War ; ARK Dumps More TSLA Stock"
4,2023-07-06 16:00:00,Twitter CEO responds to Meta Threads :  Were often imitated  
107,2023-07-06 17:15:00,The reason U . S . car sales surprised Wall Street ? People still overspend on cars . 
85,2023-07-06 21:00:00,"Tesla Inc . stock falls Thursday , underperforms market"
56,2023-07-07 07:45:00,Elon Musk SpaceX to launch satellite internet service in Mongolia
45,2023-07-07 11:15:00,New York spent $950 million in past decade on a solar - panel factory in Buffalo for Elon Musk . The promised jobs and benefits did not materialize : WSJ
127,2023-07-07 15:00:00,Mercedes - Benz EVs to use Tesla fast - charging network
58,2023-07-07 16:15:00,Innovation in EVs seen denting copper demand growth potential
192,2023-07-07 16:45:00,Why Rivian Automotive Shares Are Charging Higher Friday - Rivian Automotive ( NASDAQ : RIVN ) 
201,2023-07-07 16:45:00,"China extracts  commitment  from Tesla , others to halt price wars : report"
237,2023-07-07 16:45:00,Tesla Adds US To Global Rebate Rollout As Elon Musk Chases Market Share Gains
138,2023-07-07 17:30:00,Mercedes - Benz Is Latest Car Company to Sign On for Tesla EV Charging Stations
200,2023-07-07 18:30:00,"China extracts  commitment  from Tesla , others to halt price wars : report"
44,2023-07-07 18:30:00,"Stock Market Rally Pulls Back As Yields Jump ; Tesla , Meta In Focus : Weekly Review"
53,2023-07-07 18:30:00,Tesla wants EPA to finalize tougher vehicle emissions rules
67,2023-07-07 18:45:00,General Motors Stock Rises for 9th Straight Session . Here Why . 
231,2023-07-07 21:15:00,Tesla rolls out global customer referral incentive as EV price war heats up
142,2023-07-07 22:00:00,"Tesla Inc . stock falls Friday , underperforms market"
37,2023-07-07 22:45:00,Mercedes - Benz Joins Ford and GM In Using the Tesla Charging Network
159,2023-07-08 01:15:00,"As Disruptive Investing No Longer Surprises , Actives Benefit"
5,2023-07-08 15:30:00,What Happened to Tesla This Week ? | The Motley Fool
233,2023-07-09 18:45:00,Here How Much Tesla Would Pay You To Test Drive Its EVs This Summer
216,2023-07-10 13:15:00,Baystreet . ca - Rivian Led EV Bubble Rally Higher : Now What ? 
172,2023-07-10 15:30:00,"Tesla Model 3 is the best - selling used EV so far this year , followed by the Nissan Leaf , according to Carvana"
174,2023-07-10 19:15:00,"Used Car Prices Drop By a Record . Carvana Stock Is Up , a Lot . "
197,2023-07-10 20:30:00,"Why Nasdaq 100 Special Rebalance Is Hitting Apple Stock , Rest of Big Tech"
215,2023-07-11 03:30:00,Baystreet . ca - Rivian Led EV Bubble Rally Higher : Now What ? 
62,2023-07-11 04:00:00,"Jim Cramer Says Ford Lightning EV Truck  Better  Than Tesla Cybertruck Musk Responds - Tesla ( NASDAQ : TSLA ), Ford Motor ( NYSE : F ) "
26,2023-07-11 04:30:00,Jim Cramer Says Ford Lightning EV Truck  Better  Than Tesla Cybertruck
180,2023-07-11 13:00:00,"Rivian stock bounces premarket , but is still in danger of snapping record win streak"
235,2023-07-11 15:00:00,Stock Market Bottoms Look A Lot Alike ; Here How To Identify One
234,2023-07-11 18:00:00,"Why Rivian Stock Is In Reverse Gear Premarket Today - Tesla ( NASDAQ : TSLA ), Rivian Automotive ( NASDAQ : RIVN"
175,2023-07-11 20:00:00,Tesla ( TSLA ) pays $6 million to settle Solar Roof class action lawsuit
15,2023-07-12 10:15:00,Coinbase stock has been surging . Cathie Wood flagship fund makes its first sale in nearly a year . 
243,2023-07-12 11:00:00,"Elon Musk backs bold 2030 crypto forecast , potentially catapulting Bitcoin and Ethereum"
27,2023-07-12 13:45:00,"Lucid shares drop on flat second - quarter deliveries , production drop"
0,2023-07-12 13:45:00,Tesla is looking at its best sales quarter ever
89,2023-07-12 15:00:00,Tesla Unusual Options Activity For July 12 - Tesla ( NASDAQ : TSLA ) 
86,2023-07-12 15:00:00,Lucid Stock Is Falling Because EV Production and Deliveries Arent Good Enough
232,2023-07-12 16:30:00,Wall St rallies as cooling inflation eases Fed rate hike fears
31,2023-07-12 18:00:00,Nio Stock Eyes Return To Glory . Its EV Sales Are Set To Sharply Accelerate . 
110,2023-07-12 18:00:00,Elon Musk New xAI Company Joins Chatbot Race
41,2023-07-12 21:45:00,Markets Power Higher at Midday as Consumer Inflation Eases
50,2023-07-13 01:15:00,Elon Musk thinks China is interested in an international AI framework
202,2023-07-13 04:15:00,Elon Musk Backs Bold Crypto Forecast Agrees Traditional Currencies Could All Turn Digital By 2030 - Tesla ( NASDAQ : TSLA ) 
203,2023-07-13 04:15:00,Tesla Shanghai Gigafactory Hits Major Milestone : One Millionth Model Y Rolls Off Production Line - Tesla ( NASDAQ : TSLA ) 
182,2023-07-13 11:30:00,"Tesla New Product : A $1 , 670 Electric Quad Bike For China - Tesla ( NASDAQ : TSLA ) "
126,2023-07-13 12:45:00,Big Tech Shares to Buy Now : A complete list of Magnificent Seven stocks
1,2023-07-13 21:00:00,Tesla - 9to5Mac
17,2023-07-14 05:45:00,"Malaysian PM Anwar discusses Tesla investment , Starlink with Musk"
30,2023-07-14 17:30:00,This is the Most Wanted Car Brand in America
198,2023-07-14 19:30:00,BYD Stock : Warren Buffett - Backed BYD To See Q2 Profits Soar As Tesla Stock Hits 2023 High
55,2023-07-14 21:15:00,"Tesla Inc . stock rises Friday , outperforms market"
87,2023-07-14 21:45:00,Bullish Celebration Rudely Interrupted : Will This Be a Theme of Earnings Season ? 
19,2023-07-15 02:15:00,Elon Musk says xAI will use public tweets for AI model training
61,2023-07-15 04:30:00,"Elon Musk says xAI will examine universe , work with Twitter and Tesla | Taiwan News"
60,2023-07-15 09:00:00,"Elon Musk says xAI will examine universe , work with Twitter and Tesla"
244,2023-07-15 16:00:00,"Tesla Cybertruck Update , Lucid Production Woes , Nikola 60 % Surge And More : Biggest EV Stories Of The Week"
28,2023-07-15 16:00:00,Tesla builds first Cybertruck after two years of delays
29,2023-07-15 18:00:00,Tesla builds first Cybertruck after two years of delays
205,2023-07-17 06:00:00,Morning Bid : Bland China data leaves market hungry for stimulus
54,2023-07-17 10:15:00,"Stock Market Today : Dow Set to Open Lower ; Tesla , Microsoft Stocks and More Premarket Movers ; Bitcoin and Crypto News"
133,2023-07-17 12:30:00,"A Bunch of Giants Report This Week , but My Focus Is on 2 Semiconductor Stocks"
204,2023-07-17 12:45:00,"With High - End Luxury Car Sales Strong , Is Mercedes - Benz Stock Attractive ? "
98,2023-07-17 14:00:00,"Ford Slashes F - 150 To Under $50 , 000 Amid Tesla - Lead EV Price War"
99,2023-07-17 14:00:00,"Ford slashes prices of F - 150 Lightning trucks , base variant to cost 17 % less"
132,2023-07-17 14:15:00,German union calls for better staffing at Tesla plant amid expansion plans
18,2023-07-17 14:30:00,Ford falls after slashing prices on electric F - 150 to make them more affordable
131,2023-07-17 15:15:00,German union calls for better staffing at Tesla plant amid expansion plans
94,2023-07-17 17:00:00,Tesla sues Australia Cap - XX in Texas court over EV battery technology
185,2023-07-17 17:00:00,Ford slashes prices of F - 150 Lightning trucks as EV price war heats up
208,2023-07-17 17:15:00,Im Chase Trading This Biotech Stock Because I Like Its Odds
8,2023-07-17 17:15:00,German union calls for better staffing at Tesla plant amid expansion plans
71,2023-07-17 17:45:00,Markets Rise at Midday Ahead of Another Big Week of Earnings Reports
82,2023-07-17 17:45:00,Elon Musk Warns Against One Important Industry
83,2023-07-17 17:45:00,Tesla sues Australia Cap - XX in Texas court over EV battery technology
236,2023-07-17 17:45:00,S & P 500 at multi - month highs with big - tech earnings ahead
14,2023-07-17 19:30:00,Elizabeth Warren calls out Elon Musk for  unavoidable  conflicts of interest caused by Twitter takeover
225,2023-07-17 19:30:00,"Why Rivian Stock Dropped Today , But Canoo and Lucid Popped"
76,2023-07-17 20:00:00,"Monday Market Minute : This Week It All About Earnings - Alcoa ( NYSE : AA ), American Express ( NYSE : AXP ) "
49,2023-07-17 20:00:00,"Elizabeth Warren asks SEC to investigate Tesla - Boston News , Weather , Sports"
206,2023-07-17 20:00:00,"Ford Sees F - 150 Lightning Price Cut as Show of Strength , Stock Market Disagrees . "
113,2023-07-17 20:30:00,Ford electric F - 150 Lightning just got much cheaper
118,2023-07-17 21:00:00,Tesla Completes First Cybertruck Build Overcoming Delays
148,2023-07-17 21:00:00,Ford electric F - 150 Lightning just got much cheaper - Erie News Now
59,2023-07-17 21:00:00,Elizabeth Warren asks SEC to investigate Tesla
183,2023-07-17 22:15:00,S & P 500 Gains & Losses Today : Solar Stocks Jump After First Solar Deal
226,2023-07-18 12:00:00,Bears Are Growling Into the Wind as Positive Price Action Continues
112,2023-07-18 13:15:00,US opens new special probe into fatal Tesla crash
114,2023-07-18 14:00:00,tesla : US opens new special probe into fatal Tesla crash
220,2023-07-18 14:15:00,"Rivian stock slips , in danger of 4th - straight decline"
117,2023-07-18 15:15:00,NHTSA Opens Yet Another Special Investigation Into Tesla Over Fatal Autopilot Crashes
80,2023-07-18 16:15:00,"Tesla Q2 earnings preview : Margin  trough , Cybertruck update in focus"
134,2023-07-18 16:45:00,4 Stocks Are on My Mind as Market Moves Into Complacency
25,2023-07-18 19:00:00,NHTSA Continues Relentless Probing Of Autopilot Crashes
169,2023-07-18 21:00:00,"Tesla Inc . stock rises Tuesday , outperforms market"
74,2023-07-18 22:45:00,"Cathie Wood Sells TSLA , COIN . Buys META , HOOD , and Others"
173,2023-07-18 22:45:00,Cathie Wood Just Dumped Millions in 2 of Her Favorite Stocks
16,2023-07-19 02:15:00,"Cathie Wood ARK funds shed more Tesla and Coinbase shares , continue buying Twilio"
81,2023-07-19 04:00:00,"Cathie Wood ARK funds shed more Tesla and Coinbase shares , continue Twilio buying spree"
130,2023-07-19 05:00:00,Morning Bid : Britain CPI the next frontier
147,2023-07-19 06:30:00,Elon Musk SpaceX Is Expecting a Huge Revenue Boost This Year
228,2023-07-19 06:45:00,US opens special probe into fatal Tesla crash
24,2023-07-19 17:00:00,"Tesla Plans to Expand German Gigafactory , Creating Largest Car Plant in Europe"
156,2023-07-19 18:15:00,Tesla to hand over Musk emails to JPMorgan in lawsuit over 2018 tweet
42,2023-07-19 21:15:00,Market Rally Continues at Midday on More Positive Earnings Reports
224,2023-07-19 21:30:00,"Tesla reports 47 % rise in sales for its second quarter , but profitability shrinks"
10,2023-07-19 23:00:00,Elon Musk says Tesla ( TSLA ) Q3 2023 production will see a slight decrease from Q2
176,2023-07-19 23:00:00,Tesla Elon Musk says his new company xAI will  enhance  Tesla value
223,2023-07-19 23:15:00,"NVIDIA , Netflix , Tesla And Apple : The Negative Divergences Pile Up"
48,2023-07-19 23:30:00,"Mega - cap Earnings Post Bell , Steeper - Than - Anticipated Drop in Building Permits Keep US Equities Buoyant"
72,2023-07-19 23:45:00,Elon Musk Tesla Didnt Buy or Sell Any Bitcoin for Fourth Straight Quarter in Q2
78,2023-07-20 00:00:00,Futures Fall ; Tesla Skids On These Elon Musk Comments
13,2023-07-20 00:45:00,Why Is Tesla Stock Down After Earnings ? Is TSLA Stock a Buy Now ? 
79,2023-07-20 01:45:00,"Tesla may keep cutting prices in  turbulent time , Musk says"
3,2023-07-20 02:00:00,"Tesla Earnings , Profit Margins Beat Street Forecasts Amid Price War"
115,2023-07-20 03:30:00,Vietnam EV maker VinFast to start construction of US factory next week
7,2023-07-20 04:15:00,Why Is Tesla Stock Down After Earnings ? Is TSLA Stock a Buy Now ? 
92,2023-07-20 05:00:00,Tesla profits climb despite price cuts
158,2023-07-20 05:45:00,"Elon Musk optimistic on progress for self - driving , robots"
91,2023-07-20 10:15:00,"Nasdaq , S & P 500 futures fall after Q2 reports by Tesla , Netflix"
6,2023-07-20 12:00:00,"Tesla Elon Musk optimistic on progress for self - driving , robots"
143,2023-07-20 12:30:00,StreetInsider . com
116,2023-07-20 13:30:00,Reliable Robotics gets FAA approval to test automated aircraft systems
227,2023-07-20 14:45:00,Familiar Names Bring Earnings Tests for These ETFs
218,2023-07-20 15:45:00,"State of the Market Rally , Trading Netflix , Salesforce Breaks Out , My Tesla Move"
149,2023-07-20 15:45:00,"Tesla recalls about 16 , 000 EVs due to seat belt issue"
222,2023-07-20 17:00:00,Tesla wants to turn its Berlin factory into Europe biggest car plant
135,2023-07-20 17:30:00,"Tesla Earnings : Profit Margins Contract for Third Straight Time , Driven by Price Cuts"
77,2023-07-20 19:15:00,stock crashes on anticipated lower production and a  real  recall
90,2023-07-20 19:15:00,Tesla Stock Investors Need to Hear What Elon Musk Just Said
151,2023-07-20 21:00:00,"Tesla Inc . stock falls Thursday , underperforms market"
93,2023-07-20 21:45:00,Markets Mixed at Midday on Weaker Earnings Reports
160,2023-07-21 01:30:00,"The Nasdaq 100 Suffers Worst Day of Year , But Can We Really Call a Top ? "
73,2023-07-21 03:15:00,Dow Jones Gains As Netflix Dives ; Elon Musk Reveals This Supply Problem As Tesla Tumbles
157,2023-07-21 05:30:00,"China steps to boost sales of cars , electronics disappoint market"
9,2023-07-21 11:15:00,Tesla and Elon Musk Just Made Me a Bigger Nvidia Bull
155,2023-07-21 11:30:00,Mark Zuckerberg has led the  comeback story of the year : Morning Brief
103,2023-07-21 13:15:00,Investors Make A Bundle On 10 Stocks Others Panic Sold ( Like Tesla ) 
184,2023-07-21 14:30:00,"Sell XPeng Stock , Analyst Says . EV Price Wars Have Consequences . "
186,2023-07-21 15:45:00,"Im Glad Im Out of Tesla , but Wine Stocks Have Left a Bitter Taste in My Mouth"
100,2023-07-21 20:45:00,Appeals court to reconsider ruling on Elon Musk tweet about unions
129,2023-07-21 20:45:00,Tesla Stock Pulls Back And This Market Wizard Is Worried
150,2023-07-21 21:15:00,"Tesla Inc . stock falls Friday , underperforms market"
102,2023-07-21 22:30:00,"Tesla and Netflix shares face several weeks of weakness , stock charts warn"
75,2023-07-22 02:45:00,Dow Jones Gains As Netflix Dives ; Elon Musk Reveals This Supply Problem As Tesla Tumbles
101,2023-07-22 16:15:00,"Market Extra : Correction in Tesla , Netflix shares could last several weeks , stock charts warn"
214,2023-07-23 14:15:00,Elon Musk reveals why Dogecoin is his favorite cryptocurrency
172,2023-07-23 14:45:00,BlackRock ETF Can Change The Bitcoin Game
206,2023-07-23 15:15:00,"Call This a Spare - Tire Trade , in Case the Air Comes Out of Tesla"
245,2023-07-23 20:00:00,"Why Tesla Cybertruck Can Become A $30 Billion Business Overnight , According To One Tech Chronicler"
71,2023-07-24 05:00:00,"Elon Musk Tesla Cybertruck Spotted Sporting Clever Disguise , Masquerading As Ford F - 150"
222,2023-07-24 08:15:00,"Elon Musk Tesla Reportedly Removes Bitcoin As Payment Option , But Keeps Dogecoin"
18,2023-07-24 10:15:00,Tesla sees downgrade but price target increase at UBS
118,2023-07-24 12:00:00,Electric vehicle maker VinFast to break ground on U . S . factory this week
133,2023-07-24 12:15:00,5 Things to Know Before Markets Open
149,2023-07-24 12:15:00,Why Tesla Stock Is Down Over 1 % Premarket Today - Tesla ( NASDAQ : TSLA ) 
63,2023-07-24 14:00:00,"Futures Rise As Fed , Big Earnings Loom ; Tesla Downgraded"
92,2023-07-24 14:15:00,Bird Sheds Its Feathers : Elon Musk is Rebranding Twitter as  X  
244,2023-07-24 14:45:00,Nvidia Jumps Higher As Mizuho Analysts See $300 Billion AI Chip Potential
130,2023-07-24 15:00:00,Jim Cramer top 10 things to watch in the stock market Monday
67,2023-07-24 15:30:00,Blame the Fed ? Tesla offering 84 - month financing
70,2023-07-24 16:15:00,Tesla Analyst Downgrades Stock to Hold From Buy
12,2023-07-24 18:15:00,Tesla iPhone Moment Is Here According To Billionaire Investor Chamath Palihapitiya
69,2023-07-24 18:30:00,The New Nasdaq 100 List To Watch
106,2023-07-24 22:15:00,"Tesla Inc . stock rises Monday , outperforms market"
225,2023-07-24 23:15:00,Nvidia Jumps Higher As Mizuho Analysts See $300 Billion AI Chip Potential
191,2023-07-25 05:45:00,Ross Gerber Praises Elon Musk Tesla FSD :  Whole Thing Is Just Way Better  - Tesla ( NASDAQ : TSLA ) 
223,2023-07-25 06:45:00,Ross Gerber Praises Elon Musk Tesla FSD :  Whole Thing Is Just Way Better  
134,2023-07-25 14:30:00,Risk of a Market Top Is Increasing Rapidly
7,2023-07-25 17:45:00,"Tesla Stock Is Down 7 % Since Earnings , but the Bears Might Not Like This Take"
103,2023-07-25 18:15:00,Elon Musk to seek Supreme Court appeal of SEC  funding secured  case
16,2023-07-25 18:30:00,Worried About China Risk ? Apple Stock Might Have Just as Much as Alibaba . 
98,2023-07-25 21:00:00,"Tesla Inc . stock falls Tuesday , underperforms market"
246,2023-07-26 04:30:00,Elon Musk Responds To Survey On Split Demand For Tesla EVs In US :  Affordability Is The Limiting Factor  
173,2023-07-26 12:00:00,"Tesla Deliveries Could Jump Next Year , but the Growth Rate May Be Lower"
66,2023-07-26 15:30:00,Seven major automakers unite to build North American EV charging network
107,2023-07-26 21:00:00,"Tesla Inc . stock falls Wednesday , underperforms market"
127,2023-07-26 23:00:00,Ford Stock Rebounds From Key Level With Earnings On Deck ; This EV Stock Soars
117,2023-07-27 02:45:00,"Volkswagen buys Xpeng stake , partners with SAIC to boost China EV lineup"
221,2023-07-27 04:00:00,Elon Musk Tesla Cybertruck Spotted Testing On Californian Streets With Calibration Equipment - Tesla ( NASDAQ : TSLA ) 
234,2023-07-27 08:30:00,"Cybertruck , Tesla  Home Run ? Analyst Sees EV Pickup As  Rolling Billboard  That Will  Really Catapult  Stock"
247,2023-07-27 09:15:00,Ford earnings : Will Ford follow GM and raise its outlook for the year ? 
141,2023-07-27 15:30:00,How Big of a Problem Is Tesla Shrinking Gross Margin ? 
101,2023-07-27 16:45:00,QuantumScape Stock Is Soaring . Earnings Arent Driving the Gains . 
121,2023-07-27 17:15:00,What Going On With Tesla Stock Today ? - Tesla ( NASDAQ : TSLA ) 
