,dt,title
191,2022-12-21 22:00:00,"Tesla Inc . stock falls Wednesday , underperforms market"
110,2022-12-22 09:30:00,"Dow Jones Futures : S & P 500 Regains Key Level , But Stay Cautious ; Tesla Doubles U . S . Discount"
8,2022-12-22 14:15:00,Taiwan Semiconductor rises as Tesla reportedly picks fab over Samsung for 4nm chip orders
115,2022-12-22 14:45:00,"Tesla doubles discounts on mainstay vehicles to $7 , 500 in U . S . "
150,2022-12-22 17:45:00,Those Wishing for Santa Rally Get a Slot Machine Market Instead
200,2022-12-22 18:00:00,Why Tesla Investors Have New Concerns Today
120,2022-12-22 18:30:00,S & P 500 ( SPX ) Analysis : Lower open likely as European gains fizzle out
201,2022-12-22 19:15:00,Why Tesla Investors Have New Concerns Today
39,2022-12-22 19:45:00,"Tesla is the most profitable short pick of 2022 , with nearly $14 billion in proceeds since Elon Musk agreed to buy Twitter"
59,2022-12-22 20:00:00,EV stocks slump into 2023 as investors eye profitability over green energy dreams
90,2022-12-22 21:45:00,"Stock Market Today : Apple , Microsoft , Amazon Drag Down Nasdaq , Recession Fears Return"
177,2022-12-22 22:00:00,"Tesla Inc . stock falls Thursday , underperforms market"
30,2022-12-22 22:45:00,"U . S . Senate Finance Committee asks GM , Tesla , Toyota about Chinese supply chain"
227,2022-12-23 10:30:00,Downbeat / contained pre - Christmas trade - Newsquawk Euro Market Open
206,2022-12-23 11:15:00,"Tesla , Microsoft , AMC , and More Stock Market Movers Friday"
70,2022-12-23 11:45:00,Tesla ( TSLA ) stock fails to rebound despite CEO Musk promise he wont sell more shares
162,2022-12-23 13:45:00,"Stocks Making the Biggest Moves Premarket : Tesla , Nutanix , Meta and More"
81,2022-12-23 18:00:00,"Stock Market Falls Sharply Again As Tesla Dives , Micron Hits Chips ; Nike , FedEx Strong : Weekly Review"
145,2022-12-23 19:30:00,Why Tesla Shares Swung Wildly Friday
148,2022-12-23 20:15:00,Why Tesla Shares Swung Wildly Friday
176,2022-12-23 22:00:00,"Tesla Inc . stock falls Friday , underperforms market"
74,2022-12-23 22:15:00,Santa Largely Skips Wall Street Before Holiday
165,2022-12-24 02:00:00,Taiwan Semi Mulls Setting up a Unit in Germany
24,2022-12-24 12:30:00,"Down 64 % in 2022 , Is Tesla Stock a Buy for 2023 ? "
31,2022-12-24 12:30:00,Why Tesla Is a Top Semiconductor Stock and Not Just Another Automaker
25,2022-12-24 13:15:00,"Down 64 % in 2022 , Is Tesla Stock a Buy for 2023 ? "
34,2022-12-25 16:15:00,Is It Better to Buy Auto Chip Stock Pure Plays or Legacy Chip Stocks Getting Into Auto Technology ? 
212,2022-12-26 11:00:00,Electric Vehicles Will Be a Trillion - Dollar Industry . 3 Things Investors Need to Know
211,2022-12-26 12:00:00,Electric Vehicles Will Be a Trillion - Dollar Industry . 3 Things Investors Need to Know
88,2022-12-26 12:45:00,Elon Musk Says Earth Is  Basically Empty  And City Folks Are Just Living In Illusion
75,2022-12-26 18:00:00,Tesla extends shutdown at Shanghai plant amid COVID outbreak among workers
181,2022-12-27 15:00:00,NIO Cuts Delivery Outlook . That Not Good for Tesla . 
32,2022-12-27 17:15:00,Recent Market Updates Are Driving the Bearish Trend for Tesla Stock
31,2022-12-27 19:00:00,Recent Market Updates Are Driving the Bearish Trend for Tesla Stock
182,2022-12-27 21:30:00,"As Holiday Rally Appears Elusive , Im Watching This ETF"
189,2022-12-27 21:45:00,Stock Market Today : Tesla Sustained Slide Leads Nasdaq Lower In Choppy Trading Day
240,2022-12-27 23:30:00,"Tesla Inc . stock falls Tuesday , underperforms market"
47,2022-12-28 10:30:00,"Tesla , Nvidia , Southwest , and More Stock Market Movers Wednesday"
90,2022-12-28 12:00:00,Watch $100 - 105 support in Tesla ( TSLA ) stock
183,2022-12-28 13:30:00,"Year End Pressures Should Start to Relent , But the Bear Market Will Persist"
194,2022-12-28 13:45:00,"Stocks Making the Biggest Moves Premarket : Tesla , AMC , Southwest and Others"
24,2022-12-28 17:15:00,Tesla vs . Apple : One Is Cheaper and Grows Faster Than the Other
151,2022-12-28 18:15:00,"Amazon , Apple and Tesla Continue to Lead the New Lows"
25,2022-12-28 18:15:00,Tesla vs . Apple : One Is Cheaper and Grows Faster Than the Other
148,2022-12-28 20:45:00,Take MarketWatch 2022 Quiz : How much do you know about the biggest financial stories of the year ? 
231,2022-12-28 22:00:00,"Tesla Inc . stock rises Wednesday , outperforms market"
45,2022-12-28 22:30:00,Tesla stock breaks record - tying losing streak with best daily gain in nearly a month
142,2022-12-29 10:45:00,Musk tells Tesla workers not to be  bothered by stock market craziness  
126,2022-12-29 11:00:00,"Apple , Tesla , Disney , and More Stock Market Movers Thursday"
95,2022-12-29 12:45:00,"After Tesla ( TSLA ) bloodbath , analyst says Apple ( AAPL ) stock could fall below $100 in 2023"
235,2022-12-29 13:15:00,"Stocks Making the Biggest Moves Premarket : Tesla , Cal - Maine , Southwest and Others"
59,2022-12-29 13:30:00,"Premarket Movers : Healthcare Realty Trust , DexCom , Tesla"
236,2022-12-29 13:30:00,"Stocks Making the Biggest Moves Premarket : Tesla , Cal - Maine , Southwest and Others"
184,2022-12-29 15:00:00,Last - Minute Positioning Will Dominate the Final Trading Days of the Year
149,2022-12-29 21:00:00,Baisse de laction Tesla  : Musk demande aux employés de ne pas être perturbés par  la folie des marchés  
153,2022-12-29 21:45:00,"Stock Market Today : Tesla Surge Helps Propel Nasdaq , Dow Gains Over 300 Points"
232,2022-12-29 22:00:00,"Tesla Inc . stock rises Thursday , outperforms market"
109,2022-12-30 05:15:00,Cathie Wood Continues Buying Coinbase Dip With $5 Million Stock Purchase
152,2022-12-30 13:30:00,"Stocks Making the Biggest Moves Premarket : Shaw Communications , Li Auto , Southwest and Others"
159,2022-12-30 13:45:00,"Stocks Making the Biggest Moves Premarket : Shaw Communications , Li Auto , Southwest and Others"
96,2022-12-30 13:45:00,10 things Musk needs to do to help Tesla ( TSLA ) stock recover in 2023
110,2022-12-30 14:15:00,"Doubling Down on Tesla and Coinbase , Cathie Wood Ends 2022 ARK Style"
156,2022-12-30 14:30:00,"Stocks Making the Biggest Moves Premarket : Shaw Communications , Li Auto , Southwest and Others"
41,2022-12-30 19:00:00,Stock Market Closes Out Grim 2022 With A Correction : Weekly Review
233,2022-12-30 22:00:00,"Tesla Inc . stock rises Friday , outperforms market"
50,2022-12-30 23:15:00,"Tesla told employees not to complain to managers about pay , labor director alleges"
227,2022-12-31 06:45:00,Buy Berkshire Hathaway Stock . Warren Buffett Company Remains the Ultimate Defensive Megacap . 
21,2022-12-31 14:00:00,5 Reasons Tesla Stock Is Collapsing | The Motley Fool
23,2023-01-01 00:45:00,5 Reasons Tesla Stock Is Collapsing | The Motley Fool
37,2023-01-01 14:15:00,Where Does Tesla Stock Go in 2023 ? | The Motley Fool
44,2023-01-02 16:15:00,3 Growth Stocks Down 50 % to 69 % to Buy Now
79,2023-01-02 19:00:00,Elon Musk se convirtió en la primera persona en perder $200 mil millones
22,2023-01-02 20:00:00,Elon Musk Becomes First Man Ever To Lose $200 Bln
132,2023-01-02 20:00:00,"Tesla Posts Record Q4 Deliveries of 405 , 000 , But"
101,2023-01-03 01:00:00,Elon Musk has lost more wealth than anyone in history
141,2023-01-03 10:15:00,Tesla reports record quarterly deliveries but misses estimates
70,2023-01-03 11:30:00,"China Electric Vehicle Stocks NIO , Li Auto and XPeng Rise on Delivery Data"
201,2023-01-03 18:00:00,Why Tesla Stock Crashed to Start 2023
125,2023-01-03 18:15:00,Apple Stock Falls Amid Report Of Product Orders Being Cut In Asia
200,2023-01-03 18:30:00,Why Tesla Stock Crashed to Start 2023
102,2023-01-03 18:30:00,Morgan Stanley continues to see buying opportunity in Tesla ( TSLA ) stock despite soft deliveries
238,2023-01-03 18:45:00,Change in the Calendar Doesnt Change the Character of the Market
77,2023-01-03 19:30:00,"Tesla ( TSLA ) delivered 1 . 31 million vehicles in 2022 , missing analyst expectations"
56,2023-01-03 20:30:00,South Korea Fines Tesla $2 . 2 Mln For False Advertising
66,2023-01-03 20:45:00,South Korea Fines Tesla $2 . 2 Mln For False Advertising
244,2023-01-03 21:00:00,U . S . Auto Sales : GM Should Reclaim Full - Year Sales Crown On Strong Q4
210,2023-01-03 21:45:00,"Stock Market Today : Tesla , Apple Help Sink Nasdaq On First Trading Day Of 2023"
237,2023-01-03 23:00:00,"Tesla Inc . stock falls Tuesday , underperforms market"
78,2023-01-04 00:15:00,Tesla China chief Tom Zhu promoted to global sales and manufacturing role
138,2023-01-04 01:00:00,"Apple , Tesla Arent Making Anyone Happy Right Now"
171,2023-01-04 01:30:00,"Stock Market Hits Resistance To Start 2023 As Apple Tumbles , Tesla Dives"
175,2023-01-04 09:45:00,"Tesla , Apple , Rivian , Alibaba , and More Stock Market Movers Wednesday"
202,2023-01-04 11:45:00,Trimming Tesla Stock Fair Value Estimate to $220 on Lower Near - Term Outlook
99,2023-01-04 14:00:00,Tesla ( TSLA )  ominou start has investors concerned
97,2023-01-04 14:00:00,"New year , same old Cathie Wood : ARK buys more Tesla ( TSLA ) stock on weakness"
170,2023-01-04 15:45:00,Dow Jones Rises Ahead Of Fed Minutes ; Microsoft Dives On Downgrade
169,2023-01-04 20:30:00,"Automobile , Stellantis  : l  étoile sans télescope"
224,2023-01-04 22:00:00,"Tesla Inc . stock rises Wednesday , outperforms market"
81,2023-01-05 11:15:00,Tesla deliveries in China slump in December
60,2023-01-05 11:45:00,Tesla Delivers Fewer China - Made Vehicles in December
40,2023-01-05 15:15:00,Is Tesla Stock a Buy Now ? | The Motley Fool
179,2023-01-05 16:30:00,"Tesla , Rivian stocks suffer losses of more than 5 % "
166,2023-01-05 17:30:00,Why Tesla Dropped Again Today | The Motley Fool
39,2023-01-05 17:45:00,Is Tesla Stock a Buy Now ? | The Motley Fool
167,2023-01-05 18:00:00,Why Tesla Dropped Again Today | The Motley Fool
226,2023-01-05 22:00:00,"Tesla Inc . stock falls Thursday , underperforms market"
28,2023-01-06 13:45:00,Tesla Is Cutting Prices ( Again ). Here What It Means for Investors . 
14,2023-01-06 14:00:00,Tesla rattles electric vehicle sector with more price cuts in China
114,2023-01-06 15:00:00,Tesla rebaja los precios en China por segunda vez en tres meses ante la ralentización de la demanda
98,2023-01-06 16:45:00,Citi says XPeng ( XPEV ) will suffer most from Tesla ( TSLA ) price cut
176,2023-01-06 18:15:00,"Stock Market Mostly Higher Amid Jobs Report ; Tesla Price Cuts , GE Spinoff In Focus : Weekly Review"
42,2023-01-06 19:00:00,Tesla is ringing in the new year with a 10 % weekly loss
225,2023-01-06 22:00:00,"Tesla Inc . stock rises Friday , still underperforms market"
36,2023-01-07 00:30:00,"VWAGY : Honda , General Motors , and 1 Other Auto Stock to Buy Over Tesla"
91,2023-01-08 21:30:00,"Elon Musk says he cant get fair trial in California in Tesla shareholder suit , wants Texas"
4,2023-01-09 10:30:00,"New 2023 EV tax incentives : How they work , which cars qualify , and where to get even more savings"
74,2023-01-09 12:15:00,Tesla offers discount in Singapore on EVs in inventory
150,2023-01-09 12:30:00,Berkshire Hathaway sells 1M BYD shares
63,2023-01-09 16:45:00,Tesla rallies more than 8 % as Citi optimistic about quarterly earnings
83,2023-01-09 17:00:00,Why Tesla Stock Started the Week With a Pop
145,2023-01-09 17:30:00,Tesla Stock Is Almost Up in 2023 . There Are a Couple Reasons for the Rally . 
108,2023-01-09 18:15:00,"Enough With What Isnt Working , Here Are Stocks That Are Doing Just Fine"
82,2023-01-09 18:30:00,Why Tesla Stock Started the Week With a Pop
190,2023-01-09 19:45:00,Cathie Wood Watch : Ark Buys More Tesla and Trims Nvidia Stake
85,2023-01-09 20:30:00,U . S . Stocks Up Firmly In Positive Territory ; Tech Stocks Outperform
160,2023-01-09 21:15:00,Why EV Stocks Charged Higher on Monday
136,2023-01-09 22:00:00,"Tesla Inc . stock rises Monday , outperforms market"
222,2023-01-09 22:45:00,Tesla Stock Pain Can Be Your Gain
214,2023-01-09 22:45:00,Tesla Stock Pain Can Be Your Gain | Markets Insider
223,2023-01-10 00:30:00,"Stock Market Today : Nasdaq Pops as Tesla , Coinbase Soar"
163,2023-01-10 07:15:00,Cathie Wood Watch : Ark Buys More Tesla and Trims Nvidia Stake
228,2023-01-10 09:15:00,Which Stocks Will Win ( Or Lose ) This Earnings Season ? 
54,2023-01-10 10:45:00,BYD Stock Recovers After Warren Buffett Cuts Stake Again
107,2023-01-10 14:30:00,U . S . asks Tesla about Musk tweet on driver monitoring function
55,2023-01-10 14:45:00,BYD Stock Recovers After Warren Buffett Cuts Stake Again
18,2023-01-10 14:45:00,Tesla December Chinese Sales Crashed By 41 % - AutoSpies Auto News
127,2023-01-10 15:30:00,Mercedes and Other European Car Markers Are Aiming for Tesla
168,2023-01-10 15:45:00,Wake Up Wall Street ( SPY ) ( QQQ ): Will Powell speak on policy ? 
128,2023-01-10 20:00:00,Mercedes and Other European Car Markers Are Aiming for Tesla
130,2023-01-10 22:00:00,"Tesla Inc . stock falls Tuesday , underperforms market"
234,2023-01-11 02:45:00,Tesla plans $717 million expansion at its Austin gigafactory
247,2023-01-11 09:30:00,Tesla Files Plans for $775 Million Expansion of Texas Factory
49,2023-01-11 09:30:00,Several Top Rivian Executives Depart After Production Miss
196,2023-01-11 12:45:00,Tesla ( TSLA ) to build $776m expansion at giga Texas
69,2023-01-11 13:00:00,Tesla files for $776m expansion of Texas gigafactory
146,2023-01-11 14:30:00,Tesla Stock Higher As Elon Musk Plans Factory Expansion in Texas
8,2023-01-11 15:15:00,Tesla eyes Indonesia for next electric vehicle plant
20,2023-01-11 15:45:00,Tesla ( TSLA ) reportedly files for $776 million expansion to its Texas Gigafactory
198,2023-01-11 16:30:00,Tesla Texas factory extension likely a topic at EV maker investor day
164,2023-01-11 17:15:00,A Value Investor Takes on Tesla
16,2023-01-11 17:30:00,Tesla Stock Advances As EV Giant Eyes Expansion Amid Demand Concerns
161,2023-01-11 18:00:00,"Why Tesla , Rivian , and Lucid All Popped Today"
35,2023-01-11 18:30:00,Tesla To Spend $770 Million Expanding Texas Manufacturing Pl ... 
162,2023-01-11 19:00:00,"Why Tesla , Rivian , and Lucid All Popped Today"
115,2023-01-11 22:00:00,"Tesla Inc . stock rises Wednesday , outperforms market"
84,2023-01-11 23:45:00,In Case You Missed It : January AAP Members Call Recap
111,2023-01-12 07:45:00,"Wall Street 5 Favorite Car Stocks for 2023 , Including Tesla and Copart"
38,2023-01-12 08:00:00,Cathie Wood ARK Adds Nearly $3 . 3M Shares of Coinbase
58,2023-01-12 11:00:00,"Tesla : Aktienkurs in 6 Monaten halbiert , jetzt Bärenflagge ! "
185,2023-01-12 11:45:00,3 Reasons to Buy the Dip on Tesla Stock in 2023
62,2023-01-12 13:30:00,Tesla ( TSLA ) China Plant Expansion in Doubt Over Starlink Concerns
186,2023-01-12 13:45:00,3 Reasons to Buy the Dip on Tesla Stock in 2023
106,2023-01-12 15:30:00,Lucid Production Jumps Over a Lowered Bar . The Stock Is Rising . 
248,2023-01-12 16:00:00,Lucid stock jumps toward longest win streak in 16 months after upbeat EV production numbers
93,2023-01-12 18:45:00,Why Tesla Stock Went Into Reverse on Thursday
92,2023-01-12 19:45:00,Why Tesla Stock Went Into Reverse on Thursday
137,2023-01-12 22:00:00,"Tesla Inc . stock rises Thursday , still underperforms market"
219,2023-01-13 00:15:00,Fiery Reentry : Video of Virgin Orbit Failed Launch Emerges
94,2023-01-13 05:45:00,Tesla cuts prices on electric vehicles for US market
76,2023-01-13 07:45:00,Tesla cuts prices on electric vehicles for U . S . market
3,2023-01-13 09:00:00,Tesla looks for sales rebound by cutting prices in the U . S . ( NASDAQ : TSLA ) 
173,2023-01-13 10:30:00,Tesla ( TSLA ) lowers Model 3 & Y prices in the United States
129,2023-01-13 11:15:00,Tesla Stock Slides As Deep U . S . Price Cuts Add To Margin Concern
64,2023-01-13 11:30:00,Tesla ( TSLA ) massive price cuts in US and Europe send shares lower on demand concerns
86,2023-01-13 11:30:00,"U . S . stock futures mostly steady as Bank of America , JP Morgan and other big financial names get ready to kick off earnings season"
199,2023-01-13 12:15:00,"Ford stock falls , set to snap record win streak in wake of Tesla price cuts"
51,2023-01-13 13:00:00,"S & P 500 Futures Decline in Premarket Trading ; Tesla , Logitech International Lag"
249,2023-01-13 15:15:00,Telsa stock sinks after more price cuts prompts Guggenheim to recommend investors sell
9,2023-01-13 15:45:00,Tesla U . S . price cuts mean more models are eligible for federal EV tax credit
220,2023-01-13 16:00:00,"Stock Market Rally Takes Break , Tesla Markdowns Hit Indexes ; IBD 50 Airline Tops Buy Point"
143,2023-01-13 16:45:00,Why Tesla Stock Just Hit a 1 - Week Low
215,2023-01-13 17:15:00,Is Tesla Losing Its Pricing Power -- Or Proving Its Competitive Advantage ? 
144,2023-01-13 17:45:00,Why Tesla Stock Just Hit a 1 - Week Low
218,2023-01-13 18:00:00,Is Tesla Losing Its Pricing Power -- Or Proving Its Competitive Advantage ? 
48,2023-01-13 20:00:00,Tesla Is On The Rise Following A  Key Reversal Day  
217,2023-01-13 20:30:00,"Why Nio and Lucid Dropped , but Canoo Gained Today"
89,2023-01-13 20:30:00,Judge denies request from Elon Musk to relocate trial over Tesla tweets
216,2023-01-13 20:45:00,"Why Nio and Lucid Dropped , but Canoo Gained Today"
191,2023-01-13 21:30:00,Top Wall Street Analyst Reacts to Tesla Major Price Cut Decision
131,2023-01-13 22:00:00,"Tesla Inc . stock falls Friday , underperforms market"
165,2023-01-14 00:00:00,Top Wall Street Analyst Reacts to Tesla Major Price Cut Decision
187,2023-01-14 14:00:00,Tesla Big Price Cut : A Red Flag for Investors ? 
188,2023-01-14 15:45:00,Tesla Big Price Cut : A Red Flag for Investors ? 
10,2023-01-14 16:30:00,What Happened to Tesla This Week ? | The Motley Fool
15,2023-01-16 12:00:00,7 Electric Vehicle Companies to Watch in 2023
87,2023-01-16 18:15:00,"Tesla under fire in Germany over union concerns on working hours , contracts"
120,2023-01-16 20:00:00,Cathie Wood Watch : Ark Keeps Building Its Tesla Position
80,2023-01-17 07:45:00,China Xpeng cuts prices on some models starting Tuesday
19,2023-01-17 09:45:00,Tesla China Competition Intensifies as XPeng Slashes EV Car Prices
61,2023-01-17 12:00:00,"Analysts slash estimates , stock targets on Tesla ( TSLA ) stock after price cuts"
2,2023-01-17 13:00:00,Better Buy : Tesla Stock vs . Ford Stock
6,2023-01-17 13:00:00,Why Is Everyone Talking About Tesla Stock ? 
122,2023-01-17 14:00:00,Tesla Stock Extends Rally As China EV Registrations Jump Following Price Cuts
0,2023-01-17 14:00:00,"Tesla , BYD Company among automakers investing in Indonesia ( OTCMKTS : HYMLF ) "
116,2023-01-17 14:45:00,XPeng Slashes EV Car Prices . Tesla Stock Is Rising . 
1,2023-01-17 14:45:00,Better Buy : Tesla Stock vs . Ford Stock
5,2023-01-17 14:45:00,Why Is Everyone Talking About Tesla Stock ? 
139,2023-01-17 17:30:00,Why Tesla Soared and Chinese EV Makers Dropped Tuesday
117,2023-01-17 17:45:00,China Population is Shrinking . The Global Economy Will Feel the Effects . 
140,2023-01-17 18:00:00,Why Tesla Soared and Chinese EV Makers Dropped Tuesday
68,2023-01-17 18:15:00,"Amid Overbought and Frothy Market , Im Watching These 6 Stocks"
65,2023-01-17 19:30:00,Wyoming legislature propose EV ban
178,2023-01-17 21:15:00,Davos organizers say Musk wasnt invited despite what he says
112,2023-01-17 22:00:00,"Tesla Inc . stock rises Tuesday , outperforms market"
73,2023-01-17 22:15:00,Jury selection begins in investor lawsuit against Elon
67,2023-01-17 22:45:00,"Tesla , Nvidia Prop Up Nasdaq While We Await Key Price , Retail Data"
26,2023-01-18 02:45:00,The  EXPERT Said Tesla Dropping Prices WOULDNT Help . Stores Seeing RECORD Demand Now ! 
103,2023-01-18 13:45:00,"Tesla Has the Most Valuable Car Brand , but It Isnt the Strongest"
204,2023-01-18 15:00:00,Tesla Has the Most Valuable Car Brand . Too Bad It Isnt the Strongest . 
208,2023-01-18 20:15:00,"Dow Jones Falls ; St . Louis Fed Sees 5 . 25 % Rate ; Tesla Musk Faces New Litigation ; SLB , Netflix On Tap"
113,2023-01-18 22:15:00,"Tesla Inc . stock falls Wednesday , underperforms market"
133,2023-01-19 07:45:00,How Tesla Price Cut Is Making Its Rivals Sweat
121,2023-01-19 09:15:00,Cathie Wood Watch : Ark Piles Its Tesla Holding High
203,2023-01-19 09:45:00,Tesla ( TSLA ) PT Lowered to $300 at Piper Sandler
205,2023-01-19 12:15:00,Tesla Price Cuts May Be Paying Off
206,2023-01-19 14:30:00,Tesla Price Cuts May Be Paying Off
135,2023-01-19 14:45:00,Tesla Price Cuts Arent a Sign of Weakness . Theyre a Show of Strength . 
134,2023-01-19 15:00:00,Tesla Price Cuts Arent a Sign of Weakness . Theyre a Show of Strength . 
72,2023-01-19 17:45:00,Elon Musk Tesla Trial Seems To Be Going Well
71,2023-01-19 18:00:00,Elon Musk Tesla Trial Seems To Be Going Well
192,2023-01-19 19:00:00,"Tesla price cuts spur jump in interest , Edmunds says"
57,2023-01-19 20:00:00,The Corvette E - Ray Is GM Only Hybrid . There a Good Reason for That . 
33,2023-01-19 20:15:00,Chinese automakers gain ground in Australia
213,2023-01-19 20:30:00,3 Top BlackRock Holdings You Can ( and Should ) Buy Now
118,2023-01-19 22:00:00,"Tesla Inc . stock falls Thursday , underperforms market"
123,2023-01-19 22:45:00,Embrace Contrarian Look at TSLA in EV ETF ARKQ
207,2023-01-20 00:00:00,Ford Lost a Multibillion - Dollar Deal Over Right - Wing Governor  Communism  Fears
12,2023-01-20 13:00:00,Tesla Causes Used Car Prices to Plunge -- What You Need to Know
13,2023-01-20 13:15:00,Tesla Causes Used Car Prices to Plunge -- What You Need to Know
177,2023-01-20 16:00:00,4 EV Stocks to Buy At Deeply Oversold Levels
124,2023-01-20 17:45:00,Mullen Automotive Stock Forecast : MULN down 16 . 5 % this week
158,2023-01-20 19:00:00,S & P 500 and Nasdaq 100 Fundamental Forecasts for the Week Ahead
105,2023-01-20 20:15:00,Cathie Wood Makes an Eye - Opening Prediction for Tesla
7,2023-01-20 21:45:00,Tesla pushes back Model 3 delivery times in Germany after price cuts
193,2023-01-20 22:15:00,Elon Musk takes the stand in  funding secured  case
119,2023-01-20 22:15:00,"Tesla Inc . stock rises Friday , outperforms market"
104,2023-01-20 23:15:00,Elon Musk Takes the Stand in Tesla Tweet Trial
11,2023-01-21 16:15:00,What Happened to Tesla This Week ? | The Motley Fool
17,2023-01-22 09:30:00,"Stock Market Investing Action Plan : Tesla , Chevron , Microsoft And A Blue Wave Of Earnings"
155,2023-01-22 13:45:00,"Giant Fund Buys Up Tesla and Plug Power Stock , Sells GM"
195,2023-01-23 10:45:00,This is how the happiest car shoppers bought their vehicle
52,2023-01-23 12:00:00,"Stock market news live updates : January 23 , 2023"
243,2023-01-23 12:15:00,U . S . stock futures show caution as latest bounce stalls
180,2023-01-23 16:45:00,What Tesla Stock Investors Should Know As Musk Takes The Stand
53,2023-01-23 16:45:00,Stock market news live updates : Stocks waver as big earnings week begins
46,2023-01-23 16:45:00,Why Is Tesla Stock So Cheap ? 
242,2023-01-23 18:00:00,GM May Have Some Bad News About a Manufacturing Plant
147,2023-01-23 18:45:00,Tesla stock adds to rally as Elon Musk defends  funding secured  tweets
197,2023-01-23 19:00:00,U . S . Stocks Seeing Continued Strength After Early Rally
221,2023-01-23 20:15:00,Rivian ( RIVN ) chief lobbyist to depart EV startup in February
246,2023-01-23 20:45:00,Tech Stocks Leading Extended Rally On Wall Street
229,2023-01-23 21:00:00,Why Tesla Stock Is Heating Up Again | The Motley Fool
27,2023-01-23 22:00:00,"Dow Jones Rises Ahead Of Key Economic Data , Earnings Reports ; AMD Surges On Upgrade"
172,2023-01-23 22:15:00,"Tesla Inc . stock rises Monday , outperforms market"
154,2023-01-23 22:15:00,Elon Musk : Google Alphabet had  standing interest  in buying Tesla
174,2023-01-23 22:30:00,U . S . Stocks Seeing Continued Strength After Early Rally
230,2023-01-23 23:00:00,Why Tesla Stock Is Heating Up Again | The Motley Fool
241,2023-01-23 23:15:00,Microsoft makes new  multibillion - dollar  investment in ChatGPT - maker OpenAI
100,2023-01-23 23:15:00,Tuesday Test Time for Stocks
29,2023-01-24 14:45:00,Tesla Stock : Bear vs . Bull | The Motley Fool
30,2023-01-24 15:30:00,Tesla Stock : Bear vs . Bull | The Motley Fool
33,2023-01-24 17:15:00,"Tesla earnings will be  most important  in history , Tesla bull says"
107,2023-01-24 17:30:00,"Tesla ( TSLA ) Q4 preview by Morgan Stanley : margins , prices , guidance , demand"
233,2023-01-24 18:15:00,"JPMorgan  hates Tesla and me , Musk says in court"
203,2023-01-24 22:00:00,"Tesla Inc . stock rises Tuesday , outperforms market"
113,2023-01-25 00:15:00,Biden Touts Elon Musk Promise to Spend $3 . 6 Billion on New US Manufacturing Project
48,2023-01-25 01:00:00,Tesla ( TSLA ) announces $3 . 6 billion expansion in Nevada for battery & Semi truck production
200,2023-01-25 01:30:00,TSLA Reports Earnings on Wednesday as Firm Sees Optimism
197,2023-01-25 02:30:00,Opinion : Elon Musk shows in  funding secured  trial that he does not live in the real world
154,2023-01-25 06:00:00,"Tesla plans $3 . 6 bln Nevada expansion to make Semi truck , battery cells"
103,2023-01-25 11:45:00,T . Rowe Price Brutal 2022 | Morningstar
153,2023-01-25 14:15:00,Microsoft Earnings Confirm Fears of Economic Slowing
37,2023-01-25 17:15:00,Tesla stock is top pick at Morgan Stanley ahead of earnings
44,2023-01-25 18:30:00,Elon Musk considers raising up to $3 billion to pay off Twitter debt : WSJ
130,2023-01-25 18:45:00,Elon Musk Claims a Letter From Cathie Wood Drastically Altered Tesla Future
241,2023-01-25 21:45:00,Tesla Stock Today : How This Bullish Put Spread Trade May Generate A 14 % Return
204,2023-01-25 22:00:00,"Tesla Inc . stock rises Wednesday , outperforms market"
38,2023-01-25 22:00:00,Tesla ( TSLA ) says Cybertruck is still on track to begin production in 2023
3,2023-01-25 22:00:00,Tesla ( TSLA ) Q4 2022 earnings results beat EPS and revenue expectations
198,2023-01-25 23:15:00,"Market Makes Fool of Both Bears , Bulls"
0,2023-01-26 02:45:00,Tesla ( TSLA ) Q4 2022 achieved 24 . 3 % automotive gross margin excluding tax credit sales
35,2023-01-26 11:00:00,"Tesla , IBM , Chevron , ServiceNow , and More Stock Market Movers"
