,dt,title
241,2022-06-27 02:15:00,Lucid Group Stock Looks More Vulnerable Than Tesla and Its Other Peers
45,2022-06-27 10:15:00,Better Buy : Tesla vs . Rivian | The Motley Fool
214,2022-06-27 13:30:00,"Tesla , Rivian and Nio stock price targets cut on supply chain troubles , Shanghai shutdowns"
29,2022-06-27 17:30:00,"Why Tesla Shares Rose Today , but Nio and Lucid Dropped"
173,2022-06-27 20:15:00,"Why Tesla Shares Rose Today , but Nio and Lucid Dropped"
187,2022-06-27 21:15:00,"Tesla Inc . stock falls Monday , still outperforms market"
111,2022-06-27 22:00:00,"China EV Sales : Tesla Rival BYD Breaks Out After Huge Win Streak ; Nio , Li Auto , Xpeng Due"
128,2022-06-28 11:00:00,My Top Electric Car Stock to Buy and Hold Forever
70,2022-06-28 12:00:00,"As Elon Musk Turns 51 , He Has a Lot More on His Mind Than Birthday Cake"
63,2022-06-28 16:00:00,3 Reasons Tesla Could Soar After Its Stock Split
242,2022-06-28 16:30:00,Who are the 50 people influencing markets most this year ? Tell us what you think . 
62,2022-06-28 17:30:00,Tesla stock lower ahead of second - quarter sales
51,2022-06-28 18:45:00,Why Tesla Is Due To Re - Test $1000 Highs Again
191,2022-06-28 19:30:00,Shopify Stock Split : What the Charts Say Ahead of 10 - for - 1 Split
188,2022-06-28 19:30:00,"Top 5 U . S . companies losing a total of $260 billion in market cap , led by Apple and Amazon"
38,2022-06-28 20:45:00,Why Tesla Stock Hit the Brakes Today
99,2022-06-28 21:00:00,"Tesla Inc . stock falls Tuesday , underperforms market"
39,2022-06-28 23:15:00,Why Tesla Stock Hit the Brakes Today
7,2022-06-28 23:45:00,"Tesla reportedly lays off 200 from Autopilot unit , rescinds some job offers"
25,2022-06-29 01:15:00,Liontown signs 5 - year lithium supply deal with Ford Motor
192,2022-06-29 02:15:00,"U . S . Auto Sales To Show Fresh Declines In Q2 After GM , Ford , Stellantis Idled Factories Again"
157,2022-06-29 10:45:00,"Stocks Lower , Tesla , Disney , Pinterest And Delta - 5 Thing To Know"
161,2022-06-29 11:30:00,"Tesla Closes An Office As Layoff Hits Autopilot Jobs , Including Hourly Ones"
64,2022-06-29 12:00:00,Is Tesla Finally a Buy After Declining 43 % From Its Peak ? 
125,2022-06-29 13:00:00,NIO Stock Slumps . Short - Seller Says Battery Sales Are Inflating Results . 
105,2022-06-29 17:00:00,Why Tesla Shares Kept Sliding Today | The Motley Fool
129,2022-06-29 17:00:00,My Top Electric Car Stock to Buy and Hold Forever
98,2022-06-29 21:00:00,Tesla Inc . stock underperforms Wednesday when compared to competitors
172,2022-06-30 02:45:00,"Tesla : Street Expectations for Q2 Deliveries Are Too High , Says Analyst"
104,2022-06-30 10:15:00,Why Tesla Shares Kept Sliding Today | The Motley Fool
43,2022-06-30 13:30:00,"Tesla ( TSLA ): June Delivery Numbers Will Be  Ugly , Focus is on H2"
66,2022-06-30 14:45:00,Polestar Stock News and Forecast : PSNY struggles on debut as stop - start continues
97,2022-06-30 21:00:00,"Tesla Inc . stock falls Thursday , underperforms market"
81,2022-07-01 01:15:00,Why Tesla Stock Stalled Today | The Motley Fool
215,2022-07-01 10:00:00,Elon Musk Wins Approval for SpaceX to Provide Internet to Vehicles
162,2022-07-01 11:15:00,"Tesla Closes An Office As Layoff Hits Autopilot Jobs , Including Hourly Ones"
189,2022-07-01 12:00:00,Tesla stock bounces into positive territory after China - based rivals report upbeat June deliveries
30,2022-07-01 12:00:00,"NIO , XPeng and Li Auto Deliveries Set a Record . That Can Help Tesla Too . "
18,2022-07-01 12:45:00,Tesla Stock News and Forecast : TSLA suffers on autopilot as jobs losses hit sentiment
42,2022-07-01 19:30:00,Shopify Shares Fall After 10 - For - 1 Stock Split
100,2022-07-01 21:00:00,"Tesla Inc . stock rises Friday , outperforms market"
127,2022-07-01 22:45:00,"Why Rivian , Tesla , and Lucid Stocks Crashed in June"
246,2022-07-02 00:00:00,"Welcome to Second Semester on Wall Street , Here How to Make the Grade"
216,2022-07-02 12:15:00,The Disconnect Between Tesla Business and Stock Price Continues to Grow Wider
126,2022-07-02 14:45:00, ( NASDAQ : LI ) 
218,2022-07-02 16:45:00,"Tesla Q2 Deliveries Slump To 254 , 695 As China Shutdown Takes Toll"
44,2022-07-02 19:30:00,"Tesla ( TSLA ) Delivered 254 , 695 EV Units in Q2 , Below Consensus"
217,2022-07-02 22:15:00,The Disconnect Between Tesla Business and Stock Price Continues to Grow Wider
243,2022-07-02 22:15:00,This Company Is Buying More Bitcoin in This Crypto Crash -- Should You Do the Same ? 
101,2022-07-03 10:30:00,"German road traffic agency says 59 , 000 Tesla ... "
85,2022-07-03 12:45:00,"German Road Traffic Agency Says 59 , 000 Tesla Vehicles Have Software Glitch"
78,2022-07-03 15:15:00,"German road traffic agency says 59 , 000 Tesla vehicles have software glitch"
60,2022-07-03 18:15:00,"  59 , 000 Tesla vehicles have software glitch  "
34,2022-07-04 06:30:00,"Tesla To Recall 59 , 000 Vehicles On Software Glitch"
229,2022-07-04 08:45:00,"Tesla Q2 Vehicle Production , Deliveries Rise"
65,2022-07-04 20:00:00,Tesla Q2 Deliveries Fall 18 % Due To Production Shutdowns In ... 
47,2022-07-05 10:45:00,Tesla Is No Longer the World Largest EV Seller . Here Who Is . 
17,2022-07-05 10:45:00,"Stocks Making the Biggest Moves : Tesla Falls , Texas Instruments Dips"
41,2022-07-05 11:15:00,U . K . new car sales dive 24 % in June in the worst performance in 26 years
151,2022-07-05 14:15:00,"Stocks Making the Biggest Moves Premarket : Tesla , Occidental Petroleum , Exxon Mobil and More"
153,2022-07-05 14:30:00,"Stocks Making the Biggest Moves Premarket : Tesla , Occidental Petroleum , Exxon Mobil and More"
139,2022-07-05 16:00:00,Did Tesla Lose the EV Crown ? What to Know . 
49,2022-07-05 16:15:00,"Tesla Leads the Nasdaq Lower , but This Stock Taking an Even Bigger Hit"
115,2022-07-05 16:45:00,Tesla Reports Sequential Fall in Deliveries ; Shares Slightly Undervalued
239,2022-07-05 17:00:00,"China BYD Outpaces Tesla ( TSLA ) with 641 , 400 Electric Vehicles Sold in 1st - Half"
79,2022-07-05 18:30:00,Tesla Charts Are Resisting a Downside Break
225,2022-07-05 19:45:00,"Tech giants fuel Nasdaq 100 surge , even as Dow , S & P 500 fall"
113,2022-07-05 20:30:00,Why Tesla Shares Tanked Early Tuesday
132,2022-07-05 21:00:00,Tesla Inc . stock outperforms market on strong trading day
9,2022-07-06 01:30:00,"Laid - off Tesla workers file emergency plea , allege small severance pay"
86,2022-07-06 11:00:00,"German Road Traffic Agency Says 59 , 000 Tesla Vehicles Have Software Glitch"
170,2022-07-06 13:30:00,"Rivian stock rallies after reporting  in line  delivery , production data"
112,2022-07-06 13:30:00,Why Tesla Shares Moved Higher Friday
133,2022-07-06 21:00:00,Tesla Inc . stock outperforms competitors despite losses on the day
8,2022-07-07 02:45:00,Elon Musk fathered twins with one of his top executives : report
35,2022-07-07 11:00:00,IEA warns China will soon produce 95 % of the solar supply chain
203,2022-07-07 13:00:00,Dethrone Tesla ? GM Has a Good Shot . 
83,2022-07-07 13:15:00,Meme stock GameStop jumps on share split bandwagon - BusinessWorld Online
177,2022-07-07 13:45:00,GM Auto Sales in China Plummet . The One Bright Spot is EVs . 
58,2022-07-07 16:30:00,Why Tesla Stock Is Inching Higher Today
14,2022-07-07 16:30:00,"Tesla , other EV stocks rally after China signals support for its auto industry"
82,2022-07-07 17:30:00,Tesla Inc ( TSLA ) and 4 Other Consumer Discretionary Stocks That Have Wowed Billionaire Philippe Laffont
114,2022-07-07 18:30:00,Elon Musk Boring Company Accepts Dogecoin
178,2022-07-07 19:30:00,Tesla Stock Is Soaring . Thank the Chinese Government . 
140,2022-07-07 21:00:00,Twitter says it removes 1 million spam accounts a day
154,2022-07-07 21:00:00,Tesla Inc . stock outperforms market on strong trading day
144,2022-07-08 09:45:00,US Opens Special Probe Into Fatal Tesla Pedestrian Crash in California
2,2022-07-08 13:30:00,ON Semiconductor dips even as Susquehanna highlights speculation about Tesla deal
202,2022-07-08 15:30:00,US opens special investigation into fatal Tesla crash in California
201,2022-07-08 17:15:00,Twitter is laying off a third of its talent acquisition team
116,2022-07-08 18:00:00,IPO Stocks Of The Week : Harmony Biosciences And Li Auto Are Stock Market Leaders
143,2022-07-08 20:15:00,Why Tesla Stock Popped on Friday | The Motley Fool
142,2022-07-08 20:45:00,Why Tesla Stock Popped on Friday | The Motley Fool
134,2022-07-08 21:00:00,"Tesla Inc . stock rises Friday , outperforms market"
145,2022-07-08 21:00:00,TSLA Stock News : 5 Biggest Headlines That Tesla Investors Need to Know This Week
226,2022-07-08 22:15:00,Tesla stock heads higher in after hours after Musk ends Twitter deal
166,2022-07-08 22:30:00,U . S . opens special probe into fatal Tesla pedestrian crash in California
141,2022-07-08 22:45:00,Twitter facing a  disaster scenario  as Elon Musk says he is terminating $44B acquisition
84,2022-07-08 22:45:00,Elon Musk pulls out of $44 billion Twitter deal
21,2022-07-08 23:00:00,Breaking : Elon Musk terminates Twitter deal
50,2022-07-08 23:45:00,Elon Musk tells Twitter he wants out of his deal to buy it
185,2022-07-08 23:45:00,Twitter vows legal fight after Musk pulls out of $44 billion deal
224,2022-07-09 00:00:00,Truth Social Up 17 % on Rumor Elon Musk Walks Away from Twitter Deal By Investing . com
15,2022-07-09 04:15:00,Elon Musk pulls out of $44 billion Twitter deal - Nigerian News . Latest Nigeria News . Your online Nigerian Newspaper . 
102,2022-07-09 06:00:00,Tesla sells record high China - made vehicles in June
93,2022-07-09 06:15:00,Elon Musk Deal To Buy Twitter Reported To Be In Jeopardy
6,2022-07-09 13:45:00,Elon Musk Sends a Message to Japan
53,2022-07-11 02:15:00,Twitter hires U . S . law firm Wachtell to sue Musk after pulling out of $44B deal : Reuters sources
180,2022-07-11 06:45:00,Elderly Florida couple killed after their Tesla crashes into semi in 37th crash for company
245,2022-07-11 11:30:00,Elon Musk doesnt want to buy Twitter for $44 billion Report
230,2022-07-11 18:15:00,Twitter Stock : Buy or Sell as Musk Tries to Walk Away From Deal ? 
67,2022-07-11 18:15:00,Twitter Stock Falls 7 % After Elon Musk Cancels Acquisition
68,2022-07-11 18:15:00,Why Tesla Canceled The Twitter Buyout
5,2022-07-11 21:00:00,Tesla Is Facing a Big New Obstacle
135,2022-07-11 21:45:00,"Tesla Inc . stock falls Monday , underperforms market"
87,2022-07-11 22:00:00,Why Twitter Stock Got Crushed Today | The Motley Fool
89,2022-07-11 23:45:00,Fiery Explosion Hits Elon Musk Mars Rocket Test
88,2022-07-12 00:00:00,Why Twitter Stock Got Crushed Today | The Motley Fool
20,2022-07-12 15:30:00,Elon Musk tells Trump to  hang up his hat and sail into the sunset  
167,2022-07-12 17:30:00,Why Tesla Shares Dropped Today | The Motley Fool
220,2022-07-12 17:45:00,Core Inflation Is Steadily Declining
168,2022-07-12 18:30:00,Why Tesla Shares Dropped Today | The Motley Fool
169,2022-07-12 18:30:00,What Does Google Stock Split Mean for Investors ? 
124,2022-07-12 19:30:00,Elon Musk is losing more than $130 million on his Twitter stock
155,2022-07-12 21:00:00,Tesla Inc . stock underperforms Tuesday when compared to competitors
120,2022-07-12 22:15:00,Twitter blasts Elon Musk in lawsuit seeking to uphold his $44B acquisition
190,2022-07-13 12:00:00,Tesla laying off 229 workers in autopilot analysis unit : Reports
147,2022-07-13 14:00:00,What Wrong With T . Rowe Price Blue Chip Growth ? 
231,2022-07-13 14:30:00,Stronger Than Expected CPI
71,2022-07-13 15:00:00,Twitter rises 6 % as Hindenburg takes a  long position  in company shares ( NYSE : TWTR ) 
121,2022-07-13 15:45:00,Why Twitter Stock Could Be Headed for a Downturn
204,2022-07-13 16:45:00,You Can Ignore The Elon Musk And Twitter Drama
240,2022-07-13 18:00:00,Panasonic to Build Second Battery Plant for Tesla ( TSLA ) in U . S . 
96,2022-07-13 18:00:00,Twitter Sues Elon Musk Over Cancelled Acquisition
207,2022-07-13 20:00:00,"Tesla Challenger Polestar : on Track to Sell 50 , 000 EVs in  22"
136,2022-07-13 21:00:00,"Tesla Inc . stock rises Wednesday , outperforms market"
3,2022-07-14 00:00:00,Panasonic picks Kansas for new $4B electric vehicle battery factory ( OTCMKTS : PCRFY ) 
31,2022-07-14 01:15:00,Why Tesla Stock Zoomed Ahead Today | The Motley Fool
152,2022-07-14 02:45:00,Tesla ( TSLA ) Director of AI Andrej Karpathy is leaving the company
16,2022-07-14 04:45:00,Asian markets rise despite rate - hike fears over U . S . inflation
233,2022-07-14 12:15:00,Li Auto Has Big Ambitions . It Wants to Knock Off Tesla Too . 
56,2022-07-14 12:45:00,"Tesla : Morgan Stanley Cuts PT , Credit Suisse Expects Big EPS Miss , Truist Starts at Buy"
181,2022-07-14 13:15:00,"Twitter Suffers Global Outage With 54 , 000 US Downdetector Reports"
179,2022-07-14 13:30:00,"Twitter Suffers Major Global Outage With 54 , 000 US Downdetector Reports"
232,2022-07-14 13:30:00,Li Auto Stock : EV Maker Has Big Ambitions . It Wants to Knock Off Tesla . 
33,2022-07-14 20:45:00,"Texas Power Grid Woes Hit Toyota , Tesla"
137,2022-07-14 21:00:00,"Tesla Inc . stock rises Thursday , outperforms market"
146,2022-07-14 23:30:00,"  Never Buy It  Warren Buffett Right - Hand Man Issued A Stark Crypto Warning After Terra Luna - Led Bitcoin , Ethereum , BNB , XRP , Solana , Cardano And Dogecoin Price Crash"
72,2022-07-15 02:30:00,Twitter back up after global outage
205,2022-07-15 13:30:00,"Twitter Has Upper Hand in Battle With Musk , Analyst Says . Here Are the Scenarios . "
122,2022-07-15 20:15:00,IBM Stock : What To Expect From Q2 Earnings | Investor Business Daily
37,2022-07-15 20:15:00,Musk says Tesla ( TSLA ) can lower EV prices  if inflation calms down  
138,2022-07-15 21:00:00,"Tesla Inc . stock rises Friday , still underperforms market"
90,2022-07-15 22:30:00,Bulls Get a Break in an Over - bear - ing Market
95,2022-07-18 00:15:00,"Tosca Musk , Elon Musk Sister , Reveals His Hidden Talents"
22,2022-07-18 09:45:00,New registration data shows how Tesla is doing among luxury cars and EVs ; here what catching up
1,2022-07-18 12:00:00,Tesla earnings week is here and analysts are getting more confident
193,2022-07-18 16:00:00,Earnings Focus
61,2022-07-18 16:00:00,Tesla ( TSLA ) Bull and Wedbush Analyst Dan Ives Says All Eyes On 2nd Half Expectations
175,2022-07-18 17:15:00,"Why Tesla , Rivian , and Nio Stock Popped Today"
156,2022-07-18 20:00:00,"Unity Software & ironSource Merger is Net Positive , ARK Says"
23,2022-07-19 11:45:00,"  Hot inflation is over . Here where what that means for investors , says this portfolio manager . "
195,2022-07-19 15:45:00,"Dont Get Run Over by the Bounce , But Recognize It for What It Is"
40,2022-07-19 18:15:00,Tesla ( TSLA ) board recommends shareholders vote against employee unionization
57,2022-07-19 18:15:00,Tesla Model Y is the hottest used car in the U . S . right now
69,2022-07-19 19:00:00,Will Twitter Win Lawsuit Against Elon Musk ? 
219,2022-07-19 19:00:00,Twitter ( TWTR ) Wins Expedited Trial in Musk Merger Termination Suit
48,2022-07-20 11:15:00,Stock market news live updates : Stock futures struggle to build on Tuesday rally
221,2022-07-20 12:45:00,Bulls Grab the Advantage But Still Have Much to Prove
249,2022-07-20 14:45:00,Bear Market Rally ? 
55,2022-07-20 15:15:00,Tesla ( TSLA ) Fremont Factory on a  War Footing  
0,2022-07-20 19:00:00,Listen to the Tesla ( TSLA ) Q2 2022 earnings call here
247,2022-07-20 20:30:00,"U . S . stocks end higher Wednesday , with the Nasdaq leading indexes to back - to - back gains"
174,2022-07-20 20:45:00,Florida jury finds Tesla just 1 % to blame for teen driver fiery crash
165,2022-07-20 20:45:00,"Tesla stock rises after EV maker reports better - than - expected Q2 profit , jump in sales"
158,2022-07-20 21:00:00,"Tesla Inc . stock rises Wednesday , still underperforms market"
131,2022-07-20 21:30:00,"Investors Hustle , Russell Bustles , Tech Stocks Show Muscle"
27,2022-07-20 22:45:00,"After Tesla sold most of its bitcoin , Elon Musk says he is open to buying more , though  cryptocurrency is a side show  "
238,2022-07-20 23:15:00,"Tesla Q2 Earnings : TSLA Shares Rise On Rosy Figures , Bitcoin ... "
13,2022-07-21 00:00:00,"Tesla ( TSLA ) German Gigafactory achieves 1 , 000 vehicles / week production pace"
176,2022-07-21 00:00:00,"Over 100 , 000 Tesla drivers have access to the Full Self - Driving ( FSD ) Beta"
4,2022-07-21 00:00:00,Tesla ( TSLA ) liquidated 75 % of its Bitcoin holdings in Q2 2022
198,2022-07-21 00:00:00,Elon Musk says lithium refining business is a  license to print money  
10,2022-07-21 00:00:00,Tesla ( TSLA ) hit from Bitcoin sale & impairment amounted to $106 million in Q2 2022
227,2022-07-21 00:00:00,Tesla ( TSLA ) has enough 2170 cell supply to meet 2022 EV production targets
24,2022-07-21 02:00:00,"Opinion : Tesla margins shrink despite  embarrassing  price increases , putting Elon Musk in a tough spot"
197,2022-07-21 02:15:00,"Tesla Q2 Earnings : TSLA Shares Rise on Rosy Figures , Bitcoin Falls on Sale Announcement"
19,2022-07-21 02:45:00,Tesla Musk Remains Open to Buying More Bitcoin After Selling in Q2 to Raise Cash
80,2022-07-21 04:15:00,"Tesla ( TSLA ) Tops Q2 EPS by 41c , Offers Outlook"
194,2022-07-21 08:45:00,Baidu unveils autonomous vehicle without steering wheel
103,2022-07-21 09:45:00,Bitcoin recovers after falling on news Tesla sold 75 % of its holdings
11,2022-07-21 11:00:00,Tesla investors bet on recovery and fantasy
212,2022-07-21 12:30:00,"Stocks Making the Biggest Moves Premarket : AT & T , DR Horton , Travelers and More"
248,2022-07-21 14:00:00,Baidu self - driving car : Here what it looks like to ride a Chinese robotaxi with no steering wheel
36,2022-07-21 15:30:00,Why Tesla Stock Is Gaining Ground Today
223,2022-07-21 16:15:00,Tesla Stock : Here Are the Next Upside Targets After Earnings Beat
106,2022-07-21 16:15:00,Why Tesla Stock Is Gaining Ground Today
110,2022-07-21 17:45:00,Raising Tesla Stock Fair Value Estimate to $760 on Improved Nonautomotive Outlook ; Shares Fairly Valued
108,2022-07-21 19:15:00,Tesla Gains Traction as It Drives Out of Earnings Report
237,2022-07-21 20:45:00,U . S . stocks close at 6 - week highs as Nasdaq - led winning streak extends to 3rd day
159,2022-07-21 21:00:00,Tesla Inc . stock outperforms market on strong trading day
109,2022-07-21 21:30:00,Dont Let Fear of Missing Out Get the Best of You
199,2022-07-22 01:00:00,Wall Street closes higher on strong Tesla earnings
222,2022-07-22 12:30:00,The Bounce Is Slowing in Front of Significant News Flow
196,2022-07-22 12:45:00,"U . S . stock futures push lower , with disappointing Snap results weighing on the tech sector"
52,2022-07-22 13:00:00,Tesla Reports a Huge Increase In Profit Margins as Vehicle Production Ramps Up
12,2022-07-22 15:00:00,Tesla Stock News and Forecast : TSLA Q2 earnings push FXStreet price target from $400 to $550
73,2022-07-22 16:15:00,New energy vehicle sales in China reach a new record in June
160,2022-07-22 21:00:00,Tesla Inc . stock outperforms market on strong trading day
130,2022-07-23 04:00:00,Why Tesla Shares Are Up on a Market Down Day
163,2022-07-23 13:30:00,Buttigieg : 3 reasons government  needs to encourage  EV transformation
32,2022-07-23 16:00:00,Elon Musk Has Likely Downloaded His Brain into a Robot
107,2022-07-23 16:45:00,Looking Forward : How Will Tesla Handle Increased EV Competition ? 
164,2022-07-23 23:45:00,Buttigieg : 3 reasons government  needs to encourage  EV transformation
123,2022-07-24 00:15:00,Buttigieg : 3 reasons government  needs to encourage  EV transformation
150,2022-07-24 14:45:00,Does Tesla Deserve a Trillion Dollar Valuation ? 
244,2022-07-24 15:15:00,Making sense of the markets this week : July 24
210,2022-07-24 17:15:00,Tesla Q2 Earnings Call : 3 Must - See Quotes From Elon Musk
184,2022-07-25 06:30:00,Crypto News Recap : Dubai Launches Metaverse Strategy
171,2022-07-25 12:30:00,"Stocks Making the Biggest Moves Premarket : Newmont , Squarespace , Philips and More"
228,2022-07-25 13:30:00,Tesla says it received June subpoena regarding its governance in wake of Musk take - private tweet
148,2022-07-25 13:45:00,Tesla subpoenaed over Elon Musk tweets ... again
236,2022-07-25 15:00:00,"GM Wins , Tesla Loses in Latest J . D . Power Report"
91,2022-07-25 16:15:00,Tesla Recorded $64M Gain on Bitcoin Sales in Q2
208,2022-07-25 16:30:00,"Why Lucid , ChargePoint , and Blink Charging Stocks All Dropped Monday"
54,2022-07-25 17:15:00,"US Energy Dept . set to announce $2 . 5B to GM , LG battery production - Reuters ( NYSE : GM ) "
28,2022-07-25 18:45:00,"Father of 10 children via multiple women claims no  time for shenanigans , too busy to have an affair"
94,2022-07-25 20:15:00,Musk Says One Thing Is Central to the Future of the Car
117,2022-07-25 21:00:00,Tesla Inc . stock underperforms Monday when compared to competitors
75,2022-07-25 21:30:00,Were Charged Up About These Moves
77,2022-07-26 00:45:00,Musk Says One Thing Is Central to the Future of the Car
182,2022-07-26 10:30:00,GM Trumps Its Own Earnings With Battery Supply - Chain Deals
46,2022-07-26 13:30:00,Shopify to Lay Off 10 % of Workforce . The Stock Is Plunging . 
26,2022-07-26 15:00:00,TSLQ vs . TSLH : A Look At Two New Tesla ( TSLA ) Single Stock ETFs
234,2022-07-26 15:45:00,GM Announces Big EV Battery Deals as It Targets Tesla
186,2022-07-26 16:15:00,Tesla ( TSLA ) Issues Recall as Passenger Airbag May Deploy Incorrectly
92,2022-07-26 18:15:00,Institutions sold $5 billion bitcoin for the past two months . Where will the crypto head next ? 
76,2022-07-26 19:00:00,Raising Tesla Stock Fair Value Estimate to $760 on Improved Nonautomotive Outlook ; Shares Fairly Valued
118,2022-07-26 21:00:00,"Tesla Inc . stock falls Tuesday , underperforms market"
200,2022-07-26 22:00:00,Twitter shareholders to vote on Elon Musk takeover deal on Sept . 13
183,2022-07-26 23:00:00,Twitter Sets Shareholder Vote on Musk Deal Before Trial
211,2022-07-26 23:15:00,"Why Tesla , Lucid , and Nio Stocks Were All Falling Today"
240,2022-07-27 07:30:00,U . S . Consumers are  Trading Down . How to Play It With Options . 
235,2022-07-27 11:45:00,Opinion : Elon Musk is hitting  peak hubri with his high - risk Twitter and bitcoin plays . Tesla shareholders should be concerned . 
74,2022-07-27 12:30:00,Ford Earnings Are Coming . Here What to Expect . 
241,2022-07-27 13:30:00,U . S . Consumers are  Trading Down . How to Play It With Options . 
149,2022-07-27 15:45:00,"Twitter Evaluates Office Space Needs , Joining Other Tech Firms Looking to Cut Costs"
213,2022-07-27 17:45:00,Important QQQ Sectors Showing Signs of Life
206,2022-07-27 21:15:00,Ford Earnings Needed To Clear a High Bar . They Did and the Stock Is Soaring . 
119,2022-07-27 21:15:00,"Tesla Inc . stock rises Wednesday , outperforms market"
244,2022-07-28 10:00:00,5 Monster Growth Stocks Begging to Be Bought
20,2022-07-28 12:00:00,ON Semiconductor Stock : Ready For Takeoff ( NASDAQ : ON ) 
243,2022-07-28 12:45:00,Why Did Elon Musk Sell Tesla Bitcoin ? 
157,2022-07-28 12:45:00,Ford Earnings Needed To Clear a High Bar . They Did and the Stock Is Soaring . 
179,2022-07-28 13:30:00,Giant Fireball Explodes Over Texas in Incredible Footage
183,2022-07-28 14:00:00,5 Monster Growth Stocks Begging to Be Bought
242,2022-07-28 14:15:00,Ford Has  Too Many People in Certain Places . An EV Reckoning for Auto Jobs . 
12,2022-07-28 15:00:00,First - ever incentive for used EVs is part of Manchin reversal on climate bill
144,2022-07-28 17:00:00,"Why Tesla , Nikola , and Lordstown Motors Stocks Are Rising Today"
248,2022-07-28 18:30:00,Investors Cant Afford to View the World Through Rose - Tinted VR Goggles
94,2022-07-28 21:00:00,Tesla Inc . stock outperforms competitors on strong trading day
147,2022-07-28 21:30:00,"Solar Stocks , EV Plays Rally As Energy Bill Provides Broad , Deep Incentives"
4,2022-07-28 23:30:00,Get Charged Up With These Lesser - Known Overseas EV Makers
247,2022-07-29 00:00:00,Ford Unveils an F - 150 Electric Truck for Police
197,2022-07-29 00:15:00,Ford Stock : EV Profits Are Under The Lens As Demand  Overwhelm Auto Giant
143,2022-07-29 05:30:00,Hedge Funds Arent Buying Big Tech . Secular Growth Stocks Are Hot Now . 
181,2022-07-29 09:45:00,"Elon Musk says inflation may have peaked . Bill Ackman agrees , but says the Fed is still making a mistake . "
184,2022-07-29 11:45:00,"Tesla Sold Its Bitcoin , Should You ? | The Motley Fool"
10,2022-07-29 12:45:00,"Amazon , Apple , Google and Tesla Have All Done It . Here Why Companies Split Their Stock"
182,2022-07-29 13:00:00,"Tesla Sold Its Bitcoin , Should You ? | The Motley Fool"
11,2022-07-29 13:00:00,"Amazon , Apple , Google and Tesla Have All Done It . Here Why Companies Split Their Stock"
13,2022-07-29 13:15:00,"Amazon , Apple , Google and Tesla Have All Done It . Here Why Companies Split Their Stock"
174,2022-07-29 14:45:00,Twitter trial over Elon Musk merger to begin Oct . 17
122,2022-07-29 15:45:00,"Based on the S & P 500 2008 / 1998 analogs , the market still has further to rise , but not much more . – Investment Watch"
196,2022-07-29 16:15:00,Tesla Makes More Money Than GM and Ford
145,2022-07-29 16:30:00,The Bulls Are Fighting the Fed . That Might Be a Mistake
56,2022-07-29 17:00:00,Why Tesla Shares Moved Higher Today | The Motley Fool
57,2022-07-29 17:15:00,Why Tesla Shares Moved Higher Today | The Motley Fool
249,2022-07-29 21:00:00,"Stock Market Uptrend Gains Traction ; Nasdaq 100 Jumps 1 . 6 %, Led By Apple , Amazon , Tesla"
93,2022-07-29 21:00:00,Tesla Inc . stock outperforms competitors on strong trading day
5,2022-08-01 07:30:00,"Giant Pension Bought Apple Stock . It Sold Tesla , Microsoft and AT & T . "
74,2022-08-01 13:30:00,Tesla Signs Battery Material Deals in China . Shares Are Rising . 
173,2022-08-01 17:30:00,"Why Tesla , Nio , and Li Auto Stocks All Jumped Monday"
172,2022-08-01 18:00:00,"Why Tesla , Nio , and Li Auto Stocks All Jumped Monday"
68,2022-08-01 18:00:00,How Senate Breakthrough on Climate Could Benefit ESG Investors
